address1,address2,city,country,phone,fax,website,industry,industryKey,industryDisp,sector,sectorKey,sectorDisp,longBusinessSummary,fullTimeEmployees,companyOfficers,executiveTeam,maxAge,priceHint,previousClose,open,dayLow,dayHigh,regularMarketPreviousClose,regularMarketOpen,regularMarketDayLow,regularMarketDayHigh,dividendRate,dividendYield,exDividendDate,payoutRatio,fiveYearAvgDividendYield,beta,trailingPE,forwardPE,volume,regularMarketVolume,averageVolume,averageVolume10days,averageDailyVolume10Day,bid,ask,bidSize,askSize,marketCap,nonDilutedMarketCap,fiftyTwoWeekLow,fiftyTwoWeekHigh,allTimeHigh,allTimeLow,priceToSalesTrailing12Months,fiftyDayAverage,twoHundredDayAverage,trailingAnnualDividendRate,trailingAnnualDividendYield,currency,tradeable,enterpriseValue,profitMargins,floatShares,sharesOutstanding,heldPercentInsiders,heldPercentInstitutions,impliedSharesOutstanding,bookValue,priceToBook,lastFiscalYearEnd,nextFiscalYearEnd,mostRecentQuarter,earningsQuarterlyGrowth,netIncomeToCommon,trailingEps,forwardEps,lastSplitFactor,lastSplitDate,enterpriseToRevenue,enterpriseToEbitda,52WeekChange,SandP52WeekChange,lastDividendValue,lastDividendDate,quoteType,currentPrice,recommendationKey,totalCash,totalCashPerShare,ebitda,totalDebt,quickRatio,currentRatio,totalRevenue,debtToEquity,revenuePerShare,returnOnAssets,returnOnEquity,grossProfits,freeCashflow,operatingCashflow,earningsGrowth,revenueGrowth,grossMargins,ebitdaMargins,operatingMargins,financialCurrency,symbol,language,region,typeDisp,quoteSourceName,triggerable,customPriceAlertConfidence,shortName,longName,marketState,cryptoTradeable,hasPrePostMarketData,firstTradeDateMilliseconds,regularMarketChange,regularMarketDayRange,fullExchangeName,averageDailyVolume3Month,fiftyTwoWeekLowChange,fiftyTwoWeekLowChangePercent,fiftyTwoWeekRange,fiftyTwoWeekHighChange,fiftyTwoWeekHighChangePercent,fiftyTwoWeekChangePercent,earningsTimestampStart,earningsTimestampEnd,earningsCallTimestampStart,earningsCallTimestampEnd,isEarningsDateEstimate,epsTrailingTwelveMonths,epsForward,fiftyDayAverageChange,fiftyDayAverageChangePercent,twoHundredDayAverageChange,twoHundredDayAverageChangePercent,sourceInterval,exchangeDataDelayedBy,corporateActions,regularMarketTime,exchange,messageBoardId,exchangeTimezoneName,exchangeTimezoneShortName,gmtOffSetMilliseconds,market,esgPopulated,regularMarketChangePercent,regularMarketPrice,trailingPegRatio,Company,zip,compensationAsOfEpochDate,targetHighPrice,targetLowPrice,targetMeanPrice,targetMedianPrice,recommendationMean,numberOfAnalystOpinions,averageAnalystRating,epsCurrentYear,priceEpsCurrentYear,earningsTimestamp,auditRisk,boardRisk,compensationRisk,shareHolderRightsRisk,overallRisk,governanceEpochDate,irWebsite,state,sharesShort,sharesShortPriorMonth,sharesShortPreviousMonthDate,dateShortInterest,sharesPercentSharesOut,shortRatio,shortPercentOfFloat,postMarketTime,postMarketPrice,postMarketChange,postMarketChangePercent,dividendDate,displayName,prevName,nameChangeDate
Haier Information Industry Park,Laoshan District,Qingdao,China,86 53 2889 31670,86 53 2889 31689,https://smart-home.haier.com,"Furnishings, Fixtures & Appliances",furnishings-fixtures-appliances,"Furnishings, Fixtures & Appliances",Consumer Cyclical,consumer-cyclical,Consumer Cyclical,"Haier Smart Home Co., Ltd. engages in the research, development, production, and sales of smart home appliances. The company provides refrigerators/freezers, washing machines, dryer, air conditioners, water heaters, laundry equipment, kitchen and small appliances, and smart home solutions. It offers logistics services, gold-plated products, fluorine-free refrigerators, mould and process equipment, dishwashers and gas stoves, communications and network engineering technology, and industrial design and prototype production services; distribution of household appliance business; manufacture and sale of plastic parts, precise plastics, plastic powder and sheet, coatings, assembly and sales of plastics and electronics products; wholesale and retail of medical equipment; and develops and sells software and information product. In addition, the company engages in the sale of digital products, international freight forwarding; software development; technological development; IoT technology and application services; scientific research and technical service; and residential interior decoration, professional construction operation, and equipment installation. Further, it offers urban distribution and transportation services; import and export of goods, technology, and food business; professional cleaning; waste treatment; professional cleaning and daily necessities; and energy saving technology. Additionally, the company involved in house leasing and maintenance; gift procurement; venture capital investment and consultation; smart bathroom; software development; research, development, and sales of lighting appliances; and lease and commercial business services. The company was formerly known as Qingdao Haier Co., Ltd. and changed its name to Haier Smart Home Co., Ltd. in June 2019. The company was founded in 1984 and is headquartered in Qingdao, China.",122733.0,"[{'maxAge': 1, 'name': 'Mr. Huagang  Li', 'age': 56, 'title': 'Chairman of the Board, President & CEO', 'yearBorn': 1969, 'exercisedValue': 0, 'unexercisedValue': 0}, {'maxAge': 1, 'name': 'Ms. Xiaomei  Liu', 'age': 40, 'title': 'Secretary to the Board', 'yearBorn': 1985, 'exercisedValue': 0, 'unexercisedValue': 0}, {'maxAge': 1, 'name': 'Mr. Ju Zhi  Xie', 'age': 58, 'title': 'Vice President', 'yearBorn': 1967, 'exercisedValue': 0, 'unexercisedValue': 0}, {'maxAge': 1, 'name': 'Mr. Xiaowu  Huang', 'age': 48, 'title': 'Vice President', 'yearBorn': 1977, 'exercisedValue': 0, 'unexercisedValue': 0}, {'maxAge': 1, 'name': 'Mr. Pan  Li', 'age': 49, 'title': 'VP & GM of the Overseas Platform', 'yearBorn': 1976, 'exercisedValue': 0, 'unexercisedValue': 0}, {'maxAge': 1, 'name': 'Mr. Jiangyong  Guan', 'age': 47, 'title': 'VP and GM of Water Heater & the Internet of Water Platform', 'yearBorn': 1978, 'exercisedValue': 0, 'unexercisedValue': 0}, {'maxAge': 1, 'name': 'Mr. Yong  Wu', 'age': 47, 'title': 'VP and GM of the Kitchen Appliances & the Internet of Food Platform', 'yearBorn': 1978, 'exercisedValue': 0, 'unexercisedValue': 0}, {'maxAge': 1, 'name': 'Mr. Yanfeng  Zhao', 'age': 48, 'title': 'VP & GM of the Refrigeration Business', 'yearBorn': 1977, 'exercisedValue': 0, 'unexercisedValue': 0}, {'maxAge': 1, 'name': 'Mr. Yang  Li', 'age': 49, 'title': 'VP and GM of Washing Machine & the Internet of Clothing Platform', 'yearBorn': 1976, 'exercisedValue': 0, 'unexercisedValue': 0}, {'maxAge': 1, 'name': 'Mr. Yujun  Song', 'age': 50, 'title': 'Vice President', 'yearBorn': 1975, 'exercisedValue': 0, 'unexercisedValue': 0}]",[],86400,2,24.51,24.38,23.09,24.38,24.51,24.38,23.09,24.38,1.23,5.04,1762473600,0.42700002,2.34,0.527,10.851851,9.423116,80107494,80107494,41216844,34119061,34119061,23.44,23.45,0.0,0.0,219811627008,218397512957,23.09,29.07,35.95,0.227974,0.71546423,25.514,25.90585,1.234,0.050346795,CNY,False,210206867456.0,0.06824,5953753211.0,6253028411,0.42261,0.17905001,9377629650,13.193,1.7766998,1735603200,1767139200,1759190400,0.127,20965578752,2.16,2.4875,20:10,1437004800.0,0.684,7.595,-0.13361609,0.12811458,0.2692,1762473600,EQUITY,23.44,none,55230234624,6.094,27678461952,45710643200,0.73,1.094,307229360128,36.033,33.235,0.05263,0.18163,84505108480,1717915392.0,29606832128.0,0.136,0.095,0.27506,0.09009,0.09668,CNY,600690.SS,en-US,US,Equity,Delayed Quote,False,LOW,HAIER SMART HOME CO LTD,"Haier Smart Home Co., Ltd.",PREPRE,False,False,753672600000,-1.0699997,23.09 - 24.38,Shanghai,41216844,0.35000038,0.015158094,23.09 - 29.07,-5.629999,-0.19367042,-13.3616085,1756378740,1756378740,1749020400.0,1749020400.0,False,2.16,2.4875,-2.0739994,-0.08128868,-2.465849,-0.09518503,15,15,[],1774249201,SHH,finmb_5487301,Asia/Shanghai,CST,28800000,cn_market,False,-4.365564,23.44,1.283,HAIER GROUP,,,,,,,,,,,,,,,,,,,,,,,,,,,,,,,,,,,
Midea Headquarters Building,No. 6 Midea Avenue Beiluo Town Shunde District,Foshan,China,,,https://www.mideahk.com,"Furnishings, Fixtures & Appliances",furnishings-fixtures-appliances,"Furnishings, Fixtures & Appliances",Consumer Cyclical,consumer-cyclical,Consumer Cyclical,"Midea Group Co., Ltd., together with its subsidiaries, manufactures and sells home appliances, and robotic and automation systems in China and internationally. The company operates through four segments: Smart Home Business, Smart Building Technology, New Energy and Industrial Technology, and Others. It offers household air-conditioner, central air-conditioner, heating and ventilation systems, kitchen appliances, refrigerators, washing machines, various small household appliances, elevators, high and low voltage inverters, medical imaging products, and robotics and automation system. The company also provides core components, such as compressors, motors, chips, valves, reducers, automotive parts, energy storage, photovoltaics, reducers, and automation. In addition, it provides building solutions; industrial machines robotics, logistics automation systems, and transmission systems for related solutions for medical, entertainment, and new consumer fields; as well as smart supply chain solutions. Further, the company engages in sale, wholesale, and processing of raw materials for consumer appliances; and the provision of financial services, such as deposit taking, interbank lending, consumer credit, buyer's credit, and financial leasing services. Additionally, it provides Internet of Things solutions. Midea Group Co., Ltd. was founded in 1968 and is based in Foshan, China.",198432.0,"[{'maxAge': 1, 'name': 'Mr. Hongbo  Fang', 'age': 58, 'title': 'President & Chairman', 'yearBorn': 1967, 'fiscalYear': 2024, 'totalPay': 13782000, 'exercisedValue': 0, 'unexercisedValue': 0}, {'maxAge': 1, 'name': 'Ms. Zheng  Zhong', 'age': 44, 'title': 'Vice President, CFO & Finance Director', 'yearBorn': 1981, 'fiscalYear': 2024, 'exercisedValue': 0, 'unexercisedValue': 0}, {'maxAge': 1, 'name': 'Mr. Chang  Wei', 'age': 61, 'title': 'VP & CTO', 'yearBorn': 1964, 'fiscalYear': 2024, 'exercisedValue': 0, 'unexercisedValue': 0}, {'maxAge': 1, 'name': 'Ms. Shu  Gao', 'age': 42, 'title': 'Board Secretary, Joint Company Secretary & Investor Relations Director', 'yearBorn': 1983, 'fiscalYear': 2024, 'exercisedValue': 0, 'unexercisedValue': 0}, {'maxAge': 1, 'name': 'Ms. Wenxin  Zhao', 'age': 43, 'title': 'VP & Chief People Officer', 'yearBorn': 1982, 'fiscalYear': 2024, 'exercisedValue': 0, 'unexercisedValue': 0}, {'maxAge': 1, 'name': 'Dr. Yanmin  Gu', 'age': 62, 'title': 'President of the Robotics & Automation Division, VP and Non-Independent Director', 'yearBorn': 1963, 'fiscalYear': 2024, 'totalPay': 6153000, 'exercisedValue': 0, 'unexercisedValue': 0}, {'maxAge': 1, 'name': 'Mr. Jinliang  Wang', 'age': 58, 'title': 'Vice President', 'yearBorn': 1967, 'fiscalYear': 2024, 'exercisedValue': 0, 'unexercisedValue': 0}, {'maxAge': 1, 'name': 'Mr. Jianguo  Wang', 'age': 48, 'title': 'Executive President & Director', 'yearBorn': 1977, 'fiscalYear': 2024, 'totalPay': 11614000, 'exercisedValue': 0, 'unexercisedValue': 0}, {'maxAge': 1, 'name': 'Mr. Xiaoyi  Zhang', 'age': 51, 'title': 'VP & Chief Digital Officer', 'yearBorn': 1974, 'fiscalYear': 2024, 'exercisedValue': 0, 'unexercisedValue': 0}, {'maxAge': 1, 'name': 'Mr. Jinwei  Guan', 'age': 45, 'title': 'VP, President of the Building Technologies Division & Non-Independent Director', 'yearBorn': 1980, 'fiscalYear': 2024, 'totalPay': 5773000, 'exercisedValue': 0, 'unexercisedValue': 0}]",[],86400,2,75.12,75.92,72.35,73.97,75.12,75.92,72.35,73.97,4.0,5.32,1763424000,0.6014,3.69,0.655,12.606529,11.74529,46200800,46200800,32897876,21727654,21727654,73.37,73.42,,,557852393472,570049849522,66.02,83.17,108.0,10.064,1.2362866,77.8266,75.7829,4.0,0.053248134,CNY,False,531704709120.0,0.09911,5005682177.0,6952427686,0.36078998,0.22445999,7603276186,29.076,2.523387,1735603200,1767139200,1759190400,0.089,44637564928,5.82,6.24676,15:10,1462492800.0,1.178,10.794,-0.0123586655,0.12811458,0.5,1763424000,EQUITY,73.37,strong_buy,93110968320,12.275,49257033728,54717870080,0.505,1.114,451232235520,23.373,59.484,0.046729997,0.19914,117814697984,-17186527232.0,57313976320.0,0.0,0.101,0.2611,0.109160006,0.1145,CNY,000333.SZ,en-US,US,Equity,Delayed Quote,False,LOW,MIDEA GROUP CO LTD,"Midea Group Co., Ltd.",PREPRE,False,False,1379467800000,-1.75,72.35 - 73.97,Shenzhen,32897876,7.350006,0.111329995,66.02 - 83.17,-9.799995,-0.117830895,-1.2358665,1755514740,1755864000,1744354800.0,1744354800.0,False,5.82,6.24676,-4.4565964,-0.05726315,-2.4128952,-0.031839576,15,15,[],1774249479,SHZ,finmb_51997345,Asia/Shanghai,CST,28800000,cn_market,False,-2.3296058,73.37,2.0657,MIDEA GROUP,528311,1735603200.0,114.5,70.0,94.25636,94.16,1.39286,22.0,1.4 - Strong Buy,5.84318,12.556519,,,,,,,,,,,,,,,,,,,,,,,,
KaraagaC Caddesi No: 2-6,SUetlUece Beyoglu,Istanbul,Turkey,90 212 314 34 34,90 212 314 34 82,https://www.arcelikglobal.com,"Furnishings, Fixtures & Appliances",furnishings-fixtures-appliances,"Furnishings, Fixtures & Appliances",Consumer Cyclical,consumer-cyclical,Consumer Cyclical,"Arçelik Anonim Sirketi, together with its subsidiaries, produces, markets, sells, after sales services, imports, and exports consumer durable goods and electronics in Turkey, Europe, the Asia Pacific, Africa, and internationally. It operates through White Goods, Consumer Electronics, and Other segments. It offers refrigerators, freezers, washing machines, dryers, dishwashers, ovens, microwave ovens, furnaces, hoods, mini-midi ovens, waring drawers, water dispensers, water purifiers, air conditioners, combi boilers, kettles, room heaters, fans, solar panels, inverters, sun junior energy storage system, solar UPS, folding solar panel, solar backpacks, vehicle charging devices, heat pumps, televisions, smartphones, laptop and tablets, POS cash register, portable sound system, brooms, cooking utensils, irons, hygiene products, hermetic compressors, and motor pumps. The company provides its products under the Altus, Arctic, Blomberg, Hitachi, Dawlance, Arçelik, Singer, Bauknecht, Ignis, Polar, Privileg, Beko, Defy, Indesit, Elektrabregenz, Flavel, Grundig, Hotpoint, Ariston, Leisure, and VoltasBeko brand names. Arçelik Anonim Sirketi was incorporated in 1955 and is based in Istanbul, Turkey.",48784.0,"[{'maxAge': 1, 'name': 'Mr. Hakan Hamdi Bulgurlu', 'title': 'CEO, GM & Executive Director', 'exercisedValue': 0, 'unexercisedValue': 0}, {'maxAge': 1, 'name': 'Mr. Baris  Alparslan', 'age': 42, 'title': 'CFO, GM of Finance & Accounting and Head of Investor Relations', 'yearBorn': 1983, 'exercisedValue': 0, 'unexercisedValue': 0}, {'maxAge': 1, 'name': 'Mr. Nihat  Bayiz', 'title': 'Chief Production & Technology Officer', 'exercisedValue': 0, 'unexercisedValue': 0}, {'maxAge': 1, 'name': 'Mr. Umut Nazif Celik', 'title': 'General Counsel of Legal & Compliance', 'exercisedValue': 0, 'unexercisedValue': 0}, {'maxAge': 1, 'name': 'Mr. Mehmet Ragip Balcioglu', 'title': 'Global Chief Marketing & Strategy Officer', 'exercisedValue': 0, 'unexercisedValue': 0}, {'maxAge': 1, 'name': 'Mr. Fikri  Ozdemir', 'title': 'Executive Director of Human Resources', 'exercisedValue': 0, 'unexercisedValue': 0}, {'maxAge': 1, 'name': 'Dr. Fatih Kemal Ebiçlioglu', 'title': 'Information Security & Cybersecurity Manager and Non-Executive Non Independent Director', 'exercisedValue': 0, 'unexercisedValue': 0}, {'maxAge': 1, 'name': 'Mr. Cemal Can Dincer', 'title': 'Chief Commercial Officer of Turkey & South Asia', 'exercisedValue': 0, 'unexercisedValue': 0}, {'maxAge': 1, 'name': 'Mr. Cem  Kural', 'title': 'Chief Purchasing, Supply Chain Officer & Digital Officer', 'exercisedValue': 0, 'unexercisedValue': 0}, {'maxAge': 1, 'name': 'Mr. Fatih  Ozkadi', 'title': 'Chief Sustainability, Quality & Customer Care Officer', 'exercisedValue': 0, 'unexercisedValue': 0}]",[],86400,2,117.0,113.0,109.8,116.5,117.0,113.0,109.8,116.5,,,1695600000,0.0,3.1,0.056,,7.529183,2722242,2722242,3975977,1699866,1699866,116.3,116.3,0.0,0.0,76179701760,76770242289,99.65,147.5,196.1,1.190243,0.14539962,116.724,118.4555,0.0,0.0,TRY,False,214997024768.0,-0.01595,25946163.0,656155917,0.6614,0.02463,656155917,114.948,1.0100219,1767139200,1798675200,1767139200,,-8355687936,-13.74,15.42,1.025:1,1241395200.0,0.41,10.083,-0.17138809,0.12811458,2.663793,1695600000,EQUITY,116.1,none,98063319040,160.137,21322878976,235898404864,0.65,0.971,523933319168,310.78,860.917,0.00398,-0.11253,150793273344,-24391227392.0,23614763008.0,,-0.092,0.28781,0.040700004,-0.01449,TRY,ARCLK.IS,en-US,US,Equity,Delayed Quote,False,LOW,ARCELIK,Arçelik Anonim Sirketi,POSTPOST,False,False,957940200000,-0.9000015,109.8 - 116.5,Istanbul,3975977,16.449997,0.16507775,99.65 - 147.5,-31.400002,-0.21288137,-17.13881,1777042800,1777042800,1770328800.0,1770328800.0,True,-13.74,15.42,-0.62400055,-0.005345949,-2.3554993,-0.019885099,15,15,[],1774278482,IST,finmb_2482233,Europe/Istanbul,TRT,10800000,tr_market,False,-0.7692321,116.1,,BEKO GROUP,34445,,245.0,130.0,169.91615,161.91,,13.0,,5.42355,21.406643,1769785200.0,,,,,,,,,,,,,,,,,,,,,,,
"129, Samsung-ro",Yeongtong-gu,Suwon-si,South Korea,82 10 3060 0730,82 3 1200 7538,https://www.samsung.com,Consumer Electronics,consumer-electronics,Consumer Electronics,Technology,technology,Technology,"Samsung Electronics Co., Ltd. engages in the consumer electronics, information technology and mobile communications, and device solutions businesses worldwide. The company operates through four divisions: Device eXperience (DX), Device Solutions (DS), SDC, and Harman. The company offers smartphones, tablets, audio sounds, watches, switches, and accessories; TVs, and sound devices; appliances, including refrigerators, washing machines and dryers, vacuum cleaners, cooking appliances, dishwashers, air conditioners, and air purifiers; monitors and memory storage products; displays, and smart and LED signages; and other accessories. It also engages in venture capital investments, cloud services, network devices installation, semiconductor equipment services, digital advertising platforms, marketing, consulting, connected services provider, logistics, financing, and software design activities. In addition, the company provides toll processing and sales of semiconductors and display panels; development and sale of network solutions; manufacture of semiconductors and food; the provision of repair services for electronic devices; and development and supply of semiconductor process defect and quality control software, as well as digital televisions, foundry, system large scale integration (LSI). Further, it provides connected car systems, audio and visual products, enterprise automation solutions, and connected services. Samsung Electronics Co., Ltd. was incorporated in 1969 and is based in Suwon-si, South Korea.",,"[{'maxAge': 1, 'name': 'Mr. Tae-Moon  Roh Ph.D.', 'age': 57, 'title': 'CEO, Head of Mobile eXperience & Head of Device eXperience Division and Exec Director', 'yearBorn': 1968, 'fiscalYear': 2024, 'totalPay': 5099000000, 'exercisedValue': 0, 'unexercisedValue': 0}, {'maxAge': 1, 'name': 'Mr. Hark-Kyu  Park', 'age': 61, 'title': 'President & Head of Corporate Management Office at DX Division', 'yearBorn': 1964, 'fiscalYear': 2024, 'totalPay': 3346000000, 'exercisedValue': 0, 'unexercisedValue': 0}, {'maxAge': 1, 'name': 'Si-young  Choi', 'title': 'President & Head of Foundry Business', 'fiscalYear': 2024, 'totalPay': 6900000000, 'exercisedValue': 0, 'unexercisedValue': 0}, {'maxAge': 1, 'name': 'Mr. Young-Hyun  Jun', 'age': 65, 'title': 'Vice Chairman, Co-CEO & Head of the Device Solutions Division', 'yearBorn': 1960, 'fiscalYear': 2024, 'exercisedValue': 0, 'unexercisedValue': 0}, {'maxAge': 1, 'name': 'Mr. Mauro  Porcini', 'title': 'President & Chief Design Officer', 'fiscalYear': 2024, 'exercisedValue': 0, 'unexercisedValue': 0}, {'maxAge': 1, 'name': 'Mr. Hyun-Chong  Kim', 'title': 'President and Chief Legal Officer', 'fiscalYear': 2024, 'exercisedValue': 0, 'unexercisedValue': 0}, {'maxAge': 1, 'name': 'Kyungwhoon  Cheun', 'title': 'President', 'fiscalYear': 2024, 'exercisedValue': 0, 'unexercisedValue': 0}, {'maxAge': 1, 'name': 'Mr. Soon-Cheol  Park', 'age': 59, 'title': 'Executive VP & CFO', 'yearBorn': 1966, 'fiscalYear': 2024, 'exercisedValue': 0, 'unexercisedValue': 0}, {'maxAge': 1, 'name': 'Mr. Janghyun  Yoon', 'title': 'President, CTO of Device eXperience Division & Head of Samsung Research', 'fiscalYear': 2024, 'exercisedValue': 0, 'unexercisedValue': 0}, {'maxAge': 1, 'name': 'Mr. Robert M. Yi', 'title': 'Head of Investor Relations', 'fiscalYear': 2024, 'exercisedValue': 0, 'unexercisedValue': 0}]",[],86400,2,199400.0,0.0,0.0,0.0,199400.0,0.0,0.0,0.0,2264.0,1.14,1766966400,0.2526,2.39,1.121,,6.4850583,0,0,31488710,26127533,26127533,0.0,0.0,0.0,0.0,1245617288380416,1284482847229200,0.0,223000.0,223000.0,2420.0,3.7337983,173448.0,107478.5,,,KRW,False,1146721102987264.0,0.13267,5456638254.0,5876745450,0.09803,0.47963002,6686083126,,,1767139200,1798675200,1767139200,1.554,44260954996736,,,50:1,1526428800.0,3.437,12.847,2.2958677,0.12811458,566.0,1766966400,EQUITY,186300.0,strong_buy,125847113564160,18980.95,89259277025280,25239138336768,1.733,2.328,333605947572224,5.785,49784.59,0.0504,0.10783,131370424729600,23944373469184.0,85315146481664.0,1.622,0.238,0.39379,0.26756,0.21322,KRW,005930.KS,en-US,US,Equity,Delayed Quote,False,LOW,SamsungElec,"Samsung Electronics Co., Ltd.",PREPRE,False,False,946944000000,-13100.0,0.0 - 0.0,KSE,31488710,186300.0,,0.0 - 223000.0,-36700.0,-0.164574,229.58676,1777356000,1777356000,1769648400.0,1769648400.0,False,,,12852.0,0.074097134,78821.5,0.73336995,20,20,[],1774247430,KSC,finmb_91868,Asia/Seoul,KST,32400000,kr_market,False,-6.569709,186300.0,0.2245,SAMSUNG GROUP,16677,1735603200.0,340000.0,110000.0,239873.48,250000.0,1.45946,37.0,1.5 - Strong Buy,24987.16,7.455829,1769580000.0,1.0,1.0,1.0,1.0,1.0,1772323200.0,,,,,,,,,,,,,,,,,
