address1,address2,city,country,phone,fax,website,industry,industryKey,industryDisp,sector,sectorKey,sectorDisp,longBusinessSummary,fullTimeEmployees,companyOfficers,executiveTeam,maxAge,priceHint,previousClose,open,dayLow,dayHigh,regularMarketPreviousClose,regularMarketOpen,regularMarketDayLow,regularMarketDayHigh,dividendRate,dividendYield,exDividendDate,payoutRatio,fiveYearAvgDividendYield,beta,trailingPE,forwardPE,volume,regularMarketVolume,averageVolume,averageVolume10days,averageDailyVolume10Day,bid,ask,bidSize,askSize,marketCap,nonDilutedMarketCap,fiftyTwoWeekLow,fiftyTwoWeekHigh,allTimeHigh,allTimeLow,priceToSalesTrailing12Months,fiftyDayAverage,twoHundredDayAverage,trailingAnnualDividendRate,trailingAnnualDividendYield,currency,tradeable,enterpriseValue,profitMargins,floatShares,sharesOutstanding,heldPercentInsiders,heldPercentInstitutions,impliedSharesOutstanding,bookValue,priceToBook,lastFiscalYearEnd,nextFiscalYearEnd,mostRecentQuarter,earningsQuarterlyGrowth,netIncomeToCommon,trailingEps,forwardEps,lastSplitFactor,lastSplitDate,enterpriseToRevenue,enterpriseToEbitda,52WeekChange,SandP52WeekChange,lastDividendValue,lastDividendDate,quoteType,currentPrice,recommendationKey,totalCash,totalCashPerShare,ebitda,totalDebt,quickRatio,currentRatio,totalRevenue,debtToEquity,revenuePerShare,returnOnAssets,returnOnEquity,grossProfits,freeCashflow,operatingCashflow,earningsGrowth,revenueGrowth,grossMargins,ebitdaMargins,operatingMargins,financialCurrency,symbol,language,region,typeDisp,quoteSourceName,triggerable,customPriceAlertConfidence,corporateActions,regularMarketTime,exchange,messageBoardId,exchangeTimezoneName,exchangeTimezoneShortName,gmtOffSetMilliseconds,market,esgPopulated,shortName,longName,regularMarketChangePercent,regularMarketPrice,marketState,fiftyDayAverageChange,fiftyDayAverageChangePercent,twoHundredDayAverageChange,twoHundredDayAverageChangePercent,sourceInterval,exchangeDataDelayedBy,cryptoTradeable,regularMarketChange,regularMarketDayRange,fullExchangeName,averageDailyVolume3Month,fiftyTwoWeekLowChange,fiftyTwoWeekLowChangePercent,fiftyTwoWeekRange,fiftyTwoWeekHighChange,fiftyTwoWeekHighChangePercent,fiftyTwoWeekChangePercent,earningsTimestampStart,earningsTimestampEnd,earningsCallTimestampStart,earningsCallTimestampEnd,isEarningsDateEstimate,epsTrailingTwelveMonths,epsForward,hasPrePostMarketData,firstTradeDateMilliseconds,trailingPegRatio,Company,zip,compensationAsOfEpochDate,targetHighPrice,targetLowPrice,targetMeanPrice,targetMedianPrice,recommendationMean,numberOfAnalystOpinions,averageAnalystRating,epsCurrentYear,priceEpsCurrentYear,earningsTimestamp,auditRisk,boardRisk,compensationRisk,shareHolderRightsRisk,overallRisk,governanceEpochDate,irWebsite,state,sharesShort,sharesShortPriorMonth,sharesShortPreviousMonthDate,dateShortInterest,sharesPercentSharesOut,shortRatio,shortPercentOfFloat,postMarketTime,dividendDate,postMarketPrice,postMarketChange,postMarketChangePercent,displayName,prevName,nameChangeDate
Haier Information Industry Park,Laoshan District,Qingdao,China,86 53 2889 38138,86 53 2889 38313,https://smart-home.haier.com,"Furnishings, Fixtures & Appliances",furnishings-fixtures-appliances,"Furnishings, Fixtures & Appliances",Consumer Cyclical,consumer-cyclical,Consumer Cyclical,"Haier Smart Home Co., Ltd. engages in the research, development, production, and sales of smart home appliances. It operates through five segments: Home Cooking Solutions; Air Energy Solutions; Household Laundry and Care of Washing Machines and Dyers; Whole-Home Water Solutions; and Other Businesses. The company provides refrigerators/freezers, air conditioners, water heaters, laundry equipment, kitchen and small appliances, and smart home solutions. It also offers logistics services, fluorine-free refrigerators, dishwashers and gas stoves, communications and network engineering technologies, and industrial product design and prototype production services; manufacture and sale of plastic parts, precise plastics, plastic powder and sheet, and coatings; assembly and sales of plastics and electronics products; wholesale and retail of medical equipment; and develops and sells software and information product. In addition, the company engages in the sale of digital products, international freight forwarding; software development; technological development; IoT technology and application services; scientific research and technical service; and residential interior decoration, professional construction works, and equipment installation. Further, it offers urban distribution and transportation services; import and export of goods, technology, and food business; professional cleaning; waste treatment; professional cleaning and daily necessities; and energy saving technology. Additionally, the company is involved in house leasing and maintenance; venture capital investment and consultation; smart bathroom; air-conditioning equipment manufacturing; software development; research, development, and sales of lighting appliances; and lease and commercial business services. The company was formerly known as Qingdao Haier Co., Ltd. and changed its name to Haier Smart Home Co., Ltd. in June 2019. Haier Smart Home Co., Ltd. was founded in 1984 and is headquartered in Qingdao, China.",134995.0,"[{'maxAge': 1, 'name': 'Mr. Huagang  Li', 'age': 56, 'title': 'Chairman of the Board, President & CEO', 'yearBorn': 1969, 'exercisedValue': 0, 'unexercisedValue': 0}, {'maxAge': 1, 'name': 'Mr. Xiaowu  Huang', 'age': 48, 'title': 'VP & Chief Sustainability Officer', 'yearBorn': 1977, 'exercisedValue': 0, 'unexercisedValue': 0}, {'maxAge': 1, 'name': 'Ms. Xiaomei  Liu', 'age': 40, 'title': 'Secretary to the Board', 'yearBorn': 1985, 'exercisedValue': 0, 'unexercisedValue': 0}, {'maxAge': 1, 'name': 'Mr. Jiangyong  Guan', 'age': 47, 'title': 'VP and GM of Water Heater & the Internet of Water Platform', 'yearBorn': 1978, 'exercisedValue': 0, 'unexercisedValue': 0}, {'maxAge': 1, 'name': 'Mr. Yong  Wu', 'age': 47, 'title': 'VP and GM of the Kitchen Appliances & the Internet of Food Platform', 'yearBorn': 1978, 'exercisedValue': 0, 'unexercisedValue': 0}, {'maxAge': 1, 'name': 'Mr. Yanfeng  Zhao', 'age': 48, 'title': 'VP & GM of the Refrigeration Business', 'yearBorn': 1977, 'exercisedValue': 0, 'unexercisedValue': 0}, {'maxAge': 1, 'name': 'Mr. Yang  Li', 'age': 49, 'title': 'VP and GM of Washing Machine & the Internet of Clothing Platform', 'yearBorn': 1976, 'exercisedValue': 0, 'unexercisedValue': 0}, {'maxAge': 1, 'name': 'Mr. Yujun  Song', 'age': 50, 'title': 'Vice President', 'yearBorn': 1975, 'exercisedValue': 0, 'unexercisedValue': 0}, {'maxAge': 1, 'name': 'Mr. Jiacheng  Sun', 'age': 43, 'title': 'CFO & VP', 'yearBorn': 1982, 'exercisedValue': 0, 'unexercisedValue': 0}, {'maxAge': 1, 'name': 'Ke  Ying', 'title': 'Head of Accounting Organization', 'exercisedValue': 0, 'unexercisedValue': 0}]",[],86400,2,20.74,20.86,20.83,20.99,20.74,20.86,20.83,20.99,1.23,5.95,1762473600,0.5877,2.42,0.618,9.971429,8.670808,39705970,39705970,47568741,58753913,58753913,20.94,20.95,0.0,0.0,190692524032,184977529877,20.55,28.31,35.95,0.227974,0.6307079,24.3358,25.67115,1.156,0.055737708,CNY,False,183348068352,0.06467,6105104130,6253028411,0.42275003,0.18059,9106615677,12.753,1.6419666,1767139200,1798675200,1767139200,-0.392,19552798720,2.1,2.415,20:10,1437004800.0,0.606,6.907,-0.16269684,0.276026,0.2692,1762473600,EQUITY,20.94,none,59644571648,6.408,26543362048,42669477888,0.699,1.074,302346797056,33.871,32.782,0.04447,0.16475001,79614255104,6552318464.0,26002941952.0,-0.391,-0.067,0.26332,0.087790005,0.00037,CNY,600690.SS,en-US,US,Equity,Delayed Quote,False,LOW,[],1776150002,SHH,finmb_5487301,Asia/Shanghai,CST,28800000,cn_market,False,HAIER SMART HOME CO LTD,"Haier Smart Home Co., Ltd.",0.9643238,20.94,PREPRE,-3.3957996,-0.13953926,-4.7311497,-0.1842983,15,15,False,0.20000076,20.83 - 20.99,Shanghai,47568741,0.3900013,0.018978165,20.55 - 28.31,-7.369999,-0.26033202,-16.269684,1756378740,1756378740,1749020400.0,1749020400.0,False,2.1,2.415,False,753672600000,1.6253,HAIER GROUP,,,,,,,,,,,,,,,,,,,,,,,,,,,,,,,,,,,
Midea Headquarters Building,No. 6 Midea Avenue Beiluo Town Shunde District,Foshan,China,,,https://www.mideahk.com,"Furnishings, Fixtures & Appliances",furnishings-fixtures-appliances,"Furnishings, Fixtures & Appliances",Consumer Cyclical,consumer-cyclical,Consumer Cyclical,"Midea Group Co., Ltd., together with its subsidiaries, engages in the manufacture and sale of electrical appliance in China and internationally. The company operates in Smart Home System, Building Technology, Robotics and Automation, and Industrial Technology, and Other Innovative Business. It offers smart home products such as household air conditioners, central air conditioners, heating and ventilation systems, kitchen appliances, refrigerators, washing machines, and various small appliances; commercial and industrial solutions, including products and services, such as elevators, high and low voltage frequency converters, medical imaging products, robots, and automation systems; and other businesses including smart supply chain, sales, wholesale and processing of household appliance raw materials, as well as financial businesses, such as deposit taking, interbank lending, consumer credit, buyer credit, and financial leasing. Additionally, it provides Internet of Things solutions. Midea Group Co., Ltd. was founded in 1968 and is based in Foshan, China.",198570.0,"[{'maxAge': 1, 'name': 'Mr. Hongbo  Fang', 'age': 58, 'title': 'President & Chairman', 'yearBorn': 1967, 'fiscalYear': 2024, 'totalPay': 13782000, 'exercisedValue': 0, 'unexercisedValue': 0}, {'maxAge': 1, 'name': 'Mr. Jianguo  Wang', 'age': 48, 'title': 'Chief Executive Officer & Director', 'yearBorn': 1977, 'fiscalYear': 2024, 'totalPay': 11614000, 'exercisedValue': 0, 'unexercisedValue': 0}, {'maxAge': 1, 'name': 'Ms. Zheng  Zhong', 'age': 44, 'title': 'Vice President, CFO & Finance Director', 'yearBorn': 1981, 'fiscalYear': 2024, 'exercisedValue': 0, 'unexercisedValue': 0}, {'maxAge': 1, 'name': 'Mr. Chang  Wei', 'age': 61, 'title': 'VP & CTO', 'yearBorn': 1964, 'fiscalYear': 2024, 'exercisedValue': 0, 'unexercisedValue': 0}, {'maxAge': 1, 'name': 'Ms. Shu  Gao', 'age': 42, 'title': 'Board Secretary, Joint Company Secretary & Investor Relations Director', 'yearBorn': 1983, 'fiscalYear': 2024, 'exercisedValue': 0, 'unexercisedValue': 0}, {'maxAge': 1, 'name': 'Ms. Wenxin  Zhao', 'age': 43, 'title': 'VP & Chief People Officer', 'yearBorn': 1982, 'fiscalYear': 2024, 'exercisedValue': 0, 'unexercisedValue': 0}, {'maxAge': 1, 'name': 'Dr. Yanmin  Gu', 'age': 62, 'title': 'President of the Robotics & Automation Division, VP and Non-Independent Director', 'yearBorn': 1963, 'fiscalYear': 2024, 'totalPay': 6153000, 'exercisedValue': 0, 'unexercisedValue': 0}, {'maxAge': 1, 'name': 'Mr. Jinliang  Wang', 'age': 58, 'title': 'Vice President', 'yearBorn': 1967, 'fiscalYear': 2024, 'exercisedValue': 0, 'unexercisedValue': 0}, {'maxAge': 1, 'name': 'Mr. Xiaoyi  Zhang', 'age': 51, 'title': 'VP & Chief Digital Officer', 'yearBorn': 1974, 'fiscalYear': 2024, 'exercisedValue': 0, 'unexercisedValue': 0}, {'maxAge': 1, 'name': 'Mr. Jinwei  Guan', 'age': 44, 'title': 'VP, President of the Building Technologies Division & Non-Independent Director', 'yearBorn': 1981, 'fiscalYear': 2024, 'totalPay': 5773000, 'exercisedValue': 0, 'unexercisedValue': 0}]",[],86400,2,75.78,76.52,75.5,76.55,75.78,76.52,75.5,76.55,4.0,5.28,1763424000,0.6944,3.74,0.599,13.28993,11.6139,19578158,19578158,30669066,30502500,30502500,76.48,76.5,,,582105497600,574812171919,69.69,83.17,108.0,10.064,1.2752824,77.2994,76.0163,4.3,0.05674321,CNY,False,561218650112,0.09628,5019957270,6953403258,0.36097,0.22229,7604251758,29.618,2.584577,1767139200,1798675200,1767139200,-0.113,43829972992,5.76,6.59124,15:10,1462492800.0,1.23,11.027,0.060156703,0.276026,0.5,1763424000,EQUITY,76.55,strong_buy,90586398720,12.02,50897125376,67480997888,0.463,1.213,456452243456,28.542,60.383,0.04439,0.19186,119799193600,-77991632896.0,53345931264.0,-0.121,0.059,0.26246,0.11151,0.05868,CNY,000333.SZ,en-US,US,Equity,Delayed Quote,False,LOW,[],1776150270,SHZ,finmb_51997345,Asia/Shanghai,CST,28800000,cn_market,False,MIDEA GROUP CO LTD,"Midea Group Co., Ltd.",1.0161048,76.55,PREPRE,-0.7493973,-0.0096947355,0.53370667,0.007020951,15,15,False,0.7700043,75.5 - 76.55,Shenzhen,30669066,6.8600006,0.09843594,69.69 - 83.17,-6.619995,-0.07959595,6.0156703,1755514740,1755864000,1744354800.0,1744354800.0,False,5.76,6.59124,False,1379467800000,2.7597,MIDEA GROUP,528311,1735603200.0,112.6,70.0,92.71905,91.7,1.37037,21.0,1.4 - Strong Buy,6.14956,12.448046,,,,,,,,,,,,,,,,,,,,,,,,
KaraagaC Caddesi No: 2-6,SUetlUece Beyoglu,Istanbul,Turkey,90 212 314 34 34,90 212 314 34 82,https://www.arcelikglobal.com,"Furnishings, Fixtures & Appliances",furnishings-fixtures-appliances,"Furnishings, Fixtures & Appliances",Consumer Cyclical,consumer-cyclical,Consumer Cyclical,"Arçelik Anonim Sirketi, together with its subsidiaries, produces, markets, sells, after sales services, imports, and exports consumer durable goods and electronics in Turkey, Europe, the Asia Pacific, Africa, and internationally. It operates through White Goods, Consumer Electronics, and Other segments. It offers refrigerators, freezers, washing machines, dryers, dishwashers, ovens, microwave ovens, furnaces, hoods, mini-midi ovens, waring drawers, water dispensers, water purifiers, air conditioners, combi boilers, kettles, room heaters, fans, solar panels, inverters, sun junior energy storage system, solar UPS, folding solar panel, solar backpacks, vehicle charging devices, heat pumps, televisions, smartphones, laptop and tablets, POS cash register, portable sound system, brooms, cooking utensils, irons, hygiene products, hermetic compressors, and motor pumps. The company provides its products under the Altus, Arctic, Blomberg, Hitachi, Dawlance, Arçelik, Singer, Bauknecht, Ignis, Polar, Privileg, Beko, Defy, Indesit, Elektrabregenz, Flavel, Grundig, Hotpoint, Ariston, Leisure, and VoltasBeko brand names. Arçelik Anonim Sirketi was incorporated in 1955 and is based in Istanbul, Turkey.",48784.0,"[{'maxAge': 1, 'name': 'Mr. Cemal Can Dincer', 'title': 'Chief Executive Officer', 'exercisedValue': 0, 'unexercisedValue': 0}, {'maxAge': 1, 'name': 'Mr. Baris  Alparslan', 'age': 42, 'title': 'CFO, GM of Finance & Accounting and Head of Investor Relations', 'yearBorn': 1983, 'exercisedValue': 0, 'unexercisedValue': 0}, {'maxAge': 1, 'name': 'Mr. Nihat  Bayiz', 'title': 'Chief Production & Technology Officer', 'exercisedValue': 0, 'unexercisedValue': 0}, {'maxAge': 1, 'name': 'Mr. Umut Nazif Celik', 'title': 'General Counsel of Legal & Compliance', 'exercisedValue': 0, 'unexercisedValue': 0}, {'maxAge': 1, 'name': 'Mr. Mehmet Ragip Balcioglu', 'title': 'Global Chief Marketing & Strategy Officer', 'exercisedValue': 0, 'unexercisedValue': 0}, {'maxAge': 1, 'name': 'Mr. Fikri  Ozdemir', 'title': 'Executive Director of Human Resources', 'exercisedValue': 0, 'unexercisedValue': 0}, {'maxAge': 1, 'name': 'Dr. Fatih Kemal Ebiçlioglu', 'title': 'Information Security & Cybersecurity Manager and Non-Executive Non Independent Director', 'exercisedValue': 0, 'unexercisedValue': 0}, {'maxAge': 1, 'name': 'Mr. Hakan Hamdi Bulgurlu', 'title': 'GM & Executive Director', 'exercisedValue': 0, 'unexercisedValue': 0}, {'maxAge': 1, 'name': 'Mr. Cem  Kural', 'title': 'Chief Purchasing, Supply Chain Officer & Digital Officer', 'exercisedValue': 0, 'unexercisedValue': 0}, {'maxAge': 1, 'name': 'Mr. Fatih  Ozkadi', 'title': 'Chief Sustainability, Quality & Customer Care Officer', 'exercisedValue': 0, 'unexercisedValue': 0}]",[],86400,2,119.2,120.8,116.6,121.0,119.2,120.8,116.6,121.0,,,1695600000,0.0,3.1,0.129,,7.6394296,3126045,3126045,3573276,2376738,2376738,117.9,117.9,0.0,0.0,77295165440,78213785306,99.65,147.5,196.1,1.190243,0.14752863,116.552,118.188,0.0,0.0,TRY,False,216344231936,-0.01595,25946163,656155917,0.6614,0.02536,656155917,114.948,1.0248113,1767139200,1798675200,1767139200,,-8355687936,-13.73,15.42,1.025:1,1241395200.0,0.413,10.146,-0.06141734,0.276026,2.663793,1695600000,EQUITY,117.8,none,98063319040,160.137,21322878976,235898404864,0.65,0.971,523933319168,310.78,860.917,0.00398,-0.11253,150793273344,-24391227392.0,23614763008.0,,-0.092,0.28781,0.040700004,-0.01449,TRY,ARCLK.IS,en-US,US,Equity,Delayed Quote,False,LOW,[],1776179281,IST,finmb_2482233,Europe/Istanbul,TRT,10800000,tr_market,False,ARCELIK,Arçelik Anonim Sirketi,-1.1744915,117.8,POSTPOST,1.2480011,0.010707676,-0.3880005,-0.0032829093,15,15,False,-1.3999939,116.6 - 121.0,Istanbul,3573276,18.150002,0.18213749,99.65 - 147.5,-29.699997,-0.2013559,-6.141734,1776870000,1776870000,1770328800.0,1770328800.0,False,-13.73,15.42,False,957940200000,,BEKO GROUP,34445,,245.0,130.0,169.91615,161.91,,13.0,,5.42355,21.72009,1776870000.0,,,,,,,,,,,,,,,,,,,,,,,
"129, Samsung-ro",Yeongtong-gu,Suwon-si,South Korea,82 10 3060 0730,82 3 1200 7538,https://www.samsung.com,Consumer Electronics,consumer-electronics,Consumer Electronics,Technology,technology,Technology,"Samsung Electronics Co., Ltd. engages in the consumer electronics, information technology and mobile communications, and device solutions businesses worldwide. The company operates through four divisions: Device eXperience (DX), Device Solutions (DS), SDC, and Harman. The company offers smartphones, tablets, audio sounds, watches, switches, and accessories; TVs, and sound devices; appliances, including refrigerators, washing machines and dryers, vacuum cleaners, cooking appliances, dishwashers, air conditioners, and air purifiers; monitors and memory storage products; displays, and smart and LED signages; and other accessories. It also engages in venture capital investments, cloud services, network devices installation, semiconductor equipment services, digital advertising platforms, marketing, consulting, connected services provider, logistics, financing, and software design activities. In addition, the company provides toll processing and sales of semiconductors and display panels; development and sale of network solutions; manufacture of semiconductors and food; the provision of repair services for electronic devices; and development and supply of semiconductor process defect and quality control software, as well as digital televisions, foundry, system large scale integration (LSI). Further, it provides connected car systems, audio and visual products, enterprise automation solutions, and connected services. Samsung Electronics Co., Ltd. was incorporated in 1969 and is based in Suwon-si, South Korea.",,"[{'maxAge': 1, 'name': 'Mr. Tae-Moon  Roh Ph.D.', 'age': 57, 'title': 'CEO, Head of Mobile eXperience & Head of Device eXperience Division and Exec Director', 'yearBorn': 1968, 'fiscalYear': 2024, 'totalPay': 5099000000, 'exercisedValue': 0, 'unexercisedValue': 0}, {'maxAge': 1, 'name': 'Mr. Hark-Kyu  Park', 'age': 61, 'title': 'President & Head of Corporate Management Office at DX Division', 'yearBorn': 1964, 'fiscalYear': 2024, 'totalPay': 3346000000, 'exercisedValue': 0, 'unexercisedValue': 0}, {'maxAge': 1, 'name': 'Si-young  Choi', 'title': 'President & Head of Foundry Business', 'fiscalYear': 2024, 'totalPay': 6900000000, 'exercisedValue': 0, 'unexercisedValue': 0}, {'maxAge': 1, 'name': 'Mr. Young-Hyun  Jun', 'age': 65, 'title': 'Vice Chairman, Co-CEO & Head of the Device Solutions Division', 'yearBorn': 1960, 'fiscalYear': 2024, 'exercisedValue': 0, 'unexercisedValue': 0}, {'maxAge': 1, 'name': 'Mr. Mauro  Porcini', 'title': 'President & Chief Design Officer', 'fiscalYear': 2024, 'exercisedValue': 0, 'unexercisedValue': 0}, {'maxAge': 1, 'name': 'Mr. Hyun-Chong  Kim', 'title': 'President and Chief Legal Officer', 'fiscalYear': 2024, 'exercisedValue': 0, 'unexercisedValue': 0}, {'maxAge': 1, 'name': 'Kyungwhoon  Cheun', 'title': 'President', 'fiscalYear': 2024, 'exercisedValue': 0, 'unexercisedValue': 0}, {'maxAge': 1, 'name': 'Mr. Soon-Cheol  Park', 'age': 59, 'title': 'Executive VP & CFO', 'yearBorn': 1966, 'fiscalYear': 2024, 'exercisedValue': 0, 'unexercisedValue': 0}, {'maxAge': 1, 'name': 'Mr. Janghyun  Yoon', 'title': 'President, CTO of Device eXperience Division & Head of Samsung Research', 'fiscalYear': 2024, 'exercisedValue': 0, 'unexercisedValue': 0}, {'maxAge': 1, 'name': 'Mr. Robert M. Yi', 'title': 'Head of Investor Relations', 'fiscalYear': 2024, 'exercisedValue': 0, 'unexercisedValue': 0}]",[],86400,2,201000.0,0.0,0.0,0.0,201000.0,0.0,0.0,0.0,2264.0,1.13,1766966400,0.2526,2.34,1.211,,7.1882157,0,0,31084868,29740321,29740321,0.0,0.0,0.0,0.0,1362556094513152,1276117035719500,0.0,223000.0,223000.0,2420.0,4.084328,186287.0,117891.25,,,KRW,False,1280650799742976,0.13267,5456638254,5795963304,0.09803,0.47285,6598334507,,,1767139200,1798675200,1767139200,1.554,44260954996736,,,50:1,1526428800.0,3.839,14.348,2.5512369,0.276026,566.0,1766966400,EQUITY,206500.0,none,125847113564160,18980.95,89259277025280,25239138336768,1.733,2.328,333605947572224,5.785,49784.59,0.0504,0.10783,131370424729600,23944373469184.0,85315146481664.0,1.622,0.238,0.39379,0.26756,0.21322,KRW,005930.KS,en-US,US,Equity,Delayed Quote,False,LOW,[],1776148227,KSC,finmb_91868,Asia/Seoul,KST,32400000,kr_market,False,SamsungElec,"Samsung Electronics Co., Ltd.",2.7363186,206500.0,PREPRE,20213.0,0.108504616,88608.75,0.75161433,20,20,False,5500.0,0.0 - 0.0,KSE,31084868,206500.0,,0.0 - 223000.0,-16500.0,-0.07399103,255.12369,1777442400,1777442400,1777510800.0,1777510800.0,False,,,False,946944000000,0.1867,SAMSUNG GROUP,16677,1735603200.0,340000.0,110000.0,239873.48,250000.0,,37.0,,24987.16,8.264244,1777442400.0,1.0,1.0,1.0,1.0,1.0,1775001600.0,,,,,,,,,,,,,,,,,
