"Office 608, No. 108, Huitong Third Road",Hengqin NewArea,Zhuhai,China,86 75 6861 4883,86 75 6861 4998,https://www.gree.com.cn,"Furnishings, Fixtures & Appliances",furnishings-fixtures-appliances,"Furnishings, Fixtures & Appliances",Consumer Cyclical,consumer-cyclical,Consumer Cyclical,"Gree Electric Appliances, Inc. of Zhuhai engages in the production and sale of air-conditioners, home appliances, and accessories in China. It offers residential air conditioners (Acs) and home appliances, such as air purifier, air cooler, electric heater, fan, kitchen appliances, personal care appliances, refrigerator, and washing machine. The company also provides industrial products, such as screw chiller, scroll chiller, multi VRF, centrifugal chiller, light commercial, terminal, and packaged unit. Gree Electric Appliances, Inc. of Zhuhai was founded in 1989 and is headquartered in Zhuhai, China.",72808.0,"[{'maxAge': 1, 'name': 'Mr. Wei  Zhang', 'age': 47, 'title': 'President & Director', 'yearBorn': 1978, 'exercisedValue': 0, 'unexercisedValue': 0}, {'maxAge': 1, 'name': 'Mr. Jianxiong  Liao', 'age': 50, 'title': 'CFO & Assistant to the President', 'yearBorn': 1975, 'exercisedValue': 0, 'unexercisedValue': 0}, {'maxAge': 1, 'name': 'Mr. Xiangjian  Fang', 'age': 47, 'title': 'Vice President', 'yearBorn': 1978, 'exercisedValue': 0, 'unexercisedValue': 0}, {'maxAge': 1, 'name': 'Yanzi  Liu', 'title': 'Head of Accounting Department', 'exercisedValue': 0, 'unexercisedValue': 0}, {'maxAge': 1, 'name': 'Luqun  Lu', 'title': 'Director of Sales', 'exercisedValue': 0, 'unexercisedValue': 0}, {'maxAge': 1, 'name': 'Mr. Zhouhu  Zhang', 'age': 41, 'title': 'Board Secretary', 'yearBorn': 1984, 'exercisedValue': 0, 'unexercisedValue': 0}, {'maxAge': 1, 'name': 'Mr. Hua  Liu', 'age': 48, 'title': 'Vice President', 'yearBorn': 1977, 'exercisedValue': 0, 'unexercisedValue': 0}, {'maxAge': 1, 'name': 'Mr. Kai  Wang', 'age': 45, 'title': 'Vice President', 'yearBorn': 1980, 'exercisedValue': 0, 'unexercisedValue': 0}, {'maxAge': 1, 'name': 'Yusheng  Hu', 'title': 'Vice President', 'exercisedValue': 0, 'unexercisedValue': 0}, {'maxAge': 1, 'name': 'Rongyao  Bai', 'title': 'Assistant to the President', 'exercisedValue': 0, 'unexercisedValue': 0}]",[],86400,2,36.94,36.98,36.78,37.08,36.94,36.98,36.78,37.08,3.0,8.12,1769126400,0.5254,7.16,0.357,6.4728546,6.9338264,22508945,22508945,33654397,24174701,24174701,36.95,36.96,0.0,0.0,207027961856,206915928072,36.6,48.47,70.56,0.225661,1.1525798,37.8034,40.8074,3.0,0.08121278,CNY,False,152722341888,0.17639999,3813390322,5601405741,0.14310001,0.32904997,5601405741,26.078,1.4172866,1735603200,1767139200,1759190400,-0.099,31685009408,5.71,5.33039,20.1,20:10,1435881600.0,0.85,4.396,-0.18634361,0.30140376,1.0,1769126400,EQUITY,36.96,buy,145925259264,26.349,34741141504,89867640832,0.726,1.081,179621363712,60.512,32.352,0.048210002,0.23544,51814596608,12175179776.0,62385192960.0,-0.113,-0.151,0.28847,0.19341,0.19409999,CNY,000651.SZ,en-US,US,Equity,Delayed Quote,False,LOW,0.020000458,36.78 - 37.08,Shenzhen,33654397,False,PREPRE,GREE ELECTRICAL APP INC OF ZHUH,"Gree Electric Appliances, Inc. of Zhuhai",[],1776927864,False,848280600000,0.3600006,0.009836082,36.6 - 48.47,-11.510002,-0.23746651,-18.634361,1756465140,1756814400,1718348400.0,1718348400.0,True,5.71,5.33039,-0.84339905,-0.022310138,-3.8474007,-0.094281934,15,15,SHZ,finmb_9777433,Asia/Shanghai,CST,28800000,cn_market,False,0.054143097,36.96,20.1011,GREE ELECTRIC,519070,,59.0,26.0,46.57222,48.0,1.95652,18.0,5.35527,6.9016128,2.0 - Buy,,10.0,8.0,4.0,2.0,7.0,1775001600.0,http://www.gree.com.cn/gree_partner/partner_index01.jsp,,,,,,,,,,,,
Building 22E,5th Floor 22 Science Park East Avenue Hong Kong Science Park,Sha Tin,Hong Kong,852 2437 7300,852 2417 7181,https://electronics.tcl.com,Consumer Electronics,consumer-electronics,Consumer Electronics,Technology,technology,Technology,"TCL Electronics Holdings Limited, an investment holding company, operates as a consumer electronics company in Mainland China, Europe, North America, and internationally. It operates through six segments: TV; Internet Business; Smart Mobile, Connective Devices and Services; All-Category Marketing; Photovoltaic Business; and Smart Commercial Display, Smart Home and Other Businesses. The company manufactures and sells television (TV) sets, mobile phones, smart connective devices, smart commercial display and smart home products, and photovoltaic equipment. It also engages in the membership cards, video-on-demand, advertising, vertical application, and other businesses. In addition, the company distributes TCL branded air conditioners, refrigerators and washing machines, and other household appliances; and offers construction, operation, and maintenance services. Further, it is involved in trading of TV products and related components, smart commercial display products, and white goods; operation of distribution network; research and development of software of TV products; operation of the internet platform; sale of photovoltaic power generation equipment and systems; valued-added telecommunications business and internet cultural business; distribution of mobile devices and components, as well as rendering services; construction of photovoltaic power stations; and other new energy technology business. The company was formerly known as TCL Multimedia Technology Holdings Limited and changed its name to TCL Electronics Holdings Limited in June 2018. The company was incorporated in 1999 and is based in Sha Tin, Hong Kong. TCL Electronics Holdings Limited operates as a subsidiary of T.C.L. Industries Holdings (H.K.) Limited",,"[{'maxAge': 1, 'name': 'Ms. Juan  Du', 'age': 55, 'title': 'Executive Chairperson', 'yearBorn': 1970, 'fiscalYear': 2024, 'totalPay': 618000, 'exercisedValue': 0, 'unexercisedValue': 0}, {'maxAge': 1, 'name': 'Mr. Shaoyong  Zhang', 'age': 47, 'title': 'CEO & Executive Director', 'yearBorn': 1978, 'fiscalYear': 2024, 'totalPay': 3336000, 'exercisedValue': 0, 'unexercisedValue': 0}, {'maxAge': 1, 'name': 'Mr. Pan  Peng', 'age': 49, 'title': 'CFO & Executive Director', 'yearBorn': 1976, 'fiscalYear': 2024, 'totalPay': 2698000, 'exercisedValue': 0, 'unexercisedValue': 0}, {'maxAge': 1, 'name': 'Mr. Li  Sun', 'age': 48, 'title': 'Executive Director', 'yearBorn': 1977, 'fiscalYear': 2024, 'totalPay': 363000, 'exercisedValue': 0, 'unexercisedValue': 0}, {'maxAge': 1, 'name': 'Ms. Jin mei Li', 'age': 55, 'title': 'VP & Human Resource Director', 'yearBorn': 1970, 'fiscalYear': 2024, 'exercisedValue': 0, 'unexercisedValue': 0}, {'maxAge': 1, 'name': 'Mr. Wu  Chen', 'age': 53, 'title': 'SVP, GM - Business & Supply Chain Management Center and GM - CRT Business Unit', 'yearBorn': 1972, 'fiscalYear': 2024, 'exercisedValue': 0, 'unexercisedValue': 0}, {'maxAge': 1, 'name': 'Mr. Kai Sing Wong', 'age': 75, 'title': 'Senior Vice President and General Manager of Home Network Business Unit', 'yearBorn': 1950, 'fiscalYear': 2024, 'exercisedValue': 0, 'unexercisedValue': 0}, {'maxAge': 1, 'name': 'Mr. Yonghong  Song', 'age': 58, 'title': 'Senior Vice President and General Manager of Global Product Center', 'yearBorn': 1967, 'fiscalYear': 2024, 'exercisedValue': 0, 'unexercisedValue': 0}, {'maxAge': 1, 'name': 'Mr. Shanshui  Zhang', 'age': 59, 'title': 'Executive Vice President and General Manager of Global Industrial Center', 'yearBorn': 1966, 'fiscalYear': 2024, 'exercisedValue': 0, 'unexercisedValue': 0}, {'maxAge': 1, 'name': 'Mr. Weidong  Chen', 'age': 56, 'title': 'Chief Executive Officer of Home Appliances Group', 'yearBorn': 1969, 'fiscalYear': 2024, 'exercisedValue': 0, 'unexercisedValue': 0}]",[],86400,3,14.01,14.01,13.6,14.01,14.01,14.01,13.6,14.01,0.5,3.55,1782259200,0.32369998,3.66,0.445,14.040816,9.885057,4082046,4082046,9168668,7152845,7152845,13.7,13.76,0.0,0.0,34686726144,35316935840,8.75,14.78,61.323303,0.711512,0.30272186,12.6398,10.95145,0.498,0.03554604,HKD,False,26041253888,0.02178,1013718445,2520837676,0.59768003,0.16999,2520837676,7.615,1.80696,1767139200,1798675200,1767139200,0.266,2495130880,0.98,1.392,0.46,1:10,1232668800.0,0.227,8.588,0.52117264,0.30140376,0.498,1782259200,EQUITY,13.76,strong_buy,15880530944,6.299,3032222976,6536697856,0.621,1.111,114582831104,32.856,47.487,0.01899,0.13452,17900187648,,,0.248,0.111,0.15622,0.02646,0.02848,HKD,1070.HK,en-US,US,Equity,Delayed Quote,False,LOW,-0.25,13.6 - 14.01,HKSE,9168668,False,PREPRE,TCL ELECTRONICS,TCL Electronics Holdings Limited,[],1776931690,False,946949400000,5.01,0.57257146,8.75 - 14.78,-1.0199995,-0.06901214,52.117264,1742545830,1742545830,,,False,0.98,1.392,1.1202002,0.088624835,2.80855,0.25645462,15,15,HKG,finmb_2909294,Asia/Hong_Kong,HKT,28800000,hk_market,False,-1.7844396,13.76,,TCL TECHNOLOGY,,1735603200.0,16.66,14.7,15.792,16.0,1.125,5.0,1.195,11.514644,1.1 - Strong Buy,,,,,,,,,,,,,,,,,,,,
112 Chemin du Moulin Carron,,Ecully,France,33 4 72 18 18 18,,https://www.groupeseb.com,"Furnishings, Fixtures & Appliances",furnishings-fixtures-appliances,"Furnishings, Fixtures & Appliances",Consumer Cyclical,consumer-cyclical,Consumer Cyclical,"SEB SA designs, manufactures, and markets small domestic equipment in Western Europe, rest of Europe, the Middle East, Africa, North and South America, China, and rest of Asia. It operates through Consumer Business and Professional Business segments. The company provides flagship products, such as cookeo, rice cooker IH spherical, optiGrill, garment steamer, thermal-spot titanium pro fumeless wok, and crep maker billig products. It also offers electrical cooking, food preparation, and beverage preparation products, such as deep fryers, rice and pressure cookers, informal meal appliances, waffle makers, grills, toasters, multicookers, filter and pod coffee makers, espresso machines, kettles, home beer-taps, soymilk makers, blenders, cooking food processors, kitchen and juice machines, mixers, beaters, countertop ovens, and induction hobs. In addition, the company provides linen, home and personal care products that include irons and steam generators, garment steamers, canister vacuum cleaners with or without dust bag, steam and upright vacuum cleaners, vacuum weepers, fans, heaters, air treatment and hair care appliances, depilators, and bathroom scales. Further, it offers frying pans, saucepans pots, bakeware, food storage containers, carafes, flasks, thermo mugs, cutlery, and kitchen utensils. Additionally, the company designs, produces, and markets crepe and waffle makers, planchas, and grills for professionals and consumers. It sells its products under the Arno, Asia Vina, Calor, Clock, DASH, EMSA, imusa, Kaiser, Krupus, Maharaj Whiteline, MIRRO, Moulinex, OBH NORDICA, PANEX, PEBBLY, Rochedo, Rowenta, Samurai, Seb, SUPOR, Tefal T-fal, umco, WearEver, 32 DUMAS, All-Clad, de Buyer, Krampouz, LACANCHE, Lagostina, Open'Cook, SABATIER, Silit, WMF, and Forge Adour, Air'T, Ambassade de Bourgogne, Charvet, HEPP, La San Marco, Pacojet, Scaritech, Schaerer, Wilbur Curtis, and Zummo brands. SEB SA was founded in 1857 and is headquartered in Ecully, France.",31856.0,"[{'maxAge': 1, 'name': 'Mr. Stanislas  de Gramont', 'age': 59, 'title': 'CEO & Member of Management Board', 'yearBorn': 1966, 'fiscalYear': 2025, 'totalPay': 1285440, 'exercisedValue': 0, 'unexercisedValue': 0}, {'maxAge': 1, 'name': 'Mr. Olivier  Casanova', 'age': 59, 'title': 'Senior EVP of Finance, CFO & Member of Management Board', 'yearBorn': 1966, 'fiscalYear': 2025, 'exercisedValue': 0, 'unexercisedValue': 0}, {'maxAge': 1, 'name': 'Mr. Cyril  Buxtorf', 'age': 59, 'title': 'Senior EVP of Strategy & Transformation and Member of Management Board', 'yearBorn': 1966, 'fiscalYear': 2025, 'exercisedValue': 0, 'unexercisedValue': 0}, {'maxAge': 1, 'name': 'Ms. Cathy  Pianon', 'title': 'Senior EVP of Public Affairs & Communication and Member of Management Board', 'fiscalYear': 2025, 'exercisedValue': 0, 'unexercisedValue': 0}, {'maxAge': 1, 'name': 'Mr. Richard  Lelievre', 'title': 'Senior EVP of Industry & Member of Management Board', 'fiscalYear': 2025, 'exercisedValue': 0, 'unexercisedValue': 0}, {'maxAge': 1, 'name': 'Ms. Rachel  Paget', 'title': 'Senior EVP of Human Resources & Member of Management Board', 'fiscalYear': 2025, 'exercisedValue': 0, 'unexercisedValue': 0}, {'maxAge': 1, 'name': 'Mr. Philippe  Sumeire', 'age': 63, 'title': 'Executive VP of Legal & Ethics Officer & Secretary', 'yearBorn': 1962, 'fiscalYear': 2025, 'exercisedValue': 0, 'unexercisedValue': 0}, {'maxAge': 1, 'name': 'Ms. Virginie Van Haeren', 'title': 'Chief Marketing Officer', 'fiscalYear': 2025, 'exercisedValue': 0, 'unexercisedValue': 0}, {'maxAge': 1, 'name': 'Mr. Martin  Zouhar', 'title': 'Executive Vice-President of Professional Coffee Machines & Hotels', 'fiscalYear': 2025, 'exercisedValue': 0, 'unexercisedValue': 0}, {'maxAge': 1, 'name': 'Mr. Olivier  Naccache', 'title': 'Executive Vice President of Emerging Markets - Asia and Pacific', 'fiscalYear': 2025, 'exercisedValue': 0, 'unexercisedValue': 0}]",[],86400,2,48.76,48.76,48.58,50.9,48.76,48.76,48.58,50.9,2.8,5.74,1779235200,0.6292,2.87,1.137,11.2809,6.3420916,88845,88845,92703,65525,65525,0.0,0.0,0.0,0.0,2748794880,2668902248,40.84,89.5,159.90909,11.851515,0.3364745,47.4318,53.23875,2.8,0.05742412,EUR,False,5284953088,0.02994,36420193,54735485,0.4648,0.32259998,54756869,59.055,0.85005504,1767139200,1798675200,1767139200,0.848,244600000,4.45,7.91537,2.12,11:10,1614556800.0,0.647,7.75,-0.39765286,0.30140376,2.8,1779235200,EQUITY,50.2,buy,1088600064,19.869,681900032,3460800000,0.732,1.265,8169399808,99.54,149.272,0.03619,0.080570005,600899968,236037504.0,204400000.0,2.387,-0.023,0.07355,0.08347,0.0991,EUR,SK.PA,en-US,US,Equity,Delayed Quote,False,LOW,1.4400024,48.58 - 50.9,Paris,92703,False,POSTPOST,S.E.B.,SEB SA,[],1776958527,False,946886400000,9.360001,0.22918709,40.84 - 89.5,-39.3,-0.43910614,-39.765285,1772037000,1772037000,1772037000.0,1772037000.0,False,4.45,7.91537,2.7682,0.058361687,-3.0387497,-0.05707778,15,15,PAR,finmb_874364,Europe/Paris,CEST,7200000,fr_market,False,2.9532454,50.2,,GROUPE SEB,69130,1767139200.0,102.0,60.0,74.16667,74.0,1.66667,12.0,5.99945,8.367434,1.7 - Buy,1772037000.0,5.0,7.0,7.0,10.0,8.0,1775001600.0,,,,,,,,,,,,,
Via Lodovico Seitz 47,,Treviso,Italy,39 04 224131,,https://www.delonghigroup.com/it,"Furnishings, Fixtures & Appliances",furnishings-fixtures-appliances,"Furnishings, Fixtures & Appliances",Consumer Cyclical,consumer-cyclical,Consumer Cyclical,"De'Longhi S.p.A. produces and distributes coffee machines, small appliances for food preparation, coffee, nutrition, and cooking machines, air conditioning and portable heaters, domestic cleaning and ironing, and home care products. The company provides its products primarily under the De'Longhi, Kenwood, Braun, Ariete, Nutribullet, and Magic Bullet brands. It operates in Europe, the Americas, the Asia Pacific, the Middle East, India, and Africa. The company was founded in 1974 and is headquartered in Treviso, Italy. De'Longhi S.p.A. operates as a subsidiary of DE Longhi Industrial S.A.",10062.0,"[{'maxAge': 1, 'name': ""Mr. Fabio  de' Longhi"", 'age': 58, 'title': 'Chairman & CEO', 'yearBorn': 1967, 'fiscalYear': 2024, 'totalPay': 2331853, 'exercisedValue': 0, 'unexercisedValue': 0}, {'maxAge': 1, 'name': 'Mr. Fabrizio  Micheli', 'title': 'Finance Director and IRM', 'fiscalYear': 2024, 'exercisedValue': 0, 'unexercisedValue': 0}, {'maxAge': 1, 'name': 'Ms. Eliza Woolston Sheffield', 'title': ""President of De'Longhi America"", 'fiscalYear': 2024, 'exercisedValue': 0, 'unexercisedValue': 0}, {'maxAge': 1, 'name': 'Mr. Mike  Prager', 'title': ""Chief Executive Officer of De'Longhi Group North America"", 'fiscalYear': 2024, 'exercisedValue': 0, 'unexercisedValue': 0}]",[],86400,2,33.64,33.6,33.2,34.12,33.64,33.6,33.2,34.12,0.85,2.52,1779062400,0.3934,2.53,1.583,15.819906,12.835401,231561,231561,180617,183653,183653,33.64,33.68,0.0,0.0,4989407744,5028270508,25.62,39.56,40.28,1.02,1.3185068,34.3012,33.3004,0.0,0.0,EUR,False,4690366464,0.08359,44116827,149472964,0.535,0.28976,149472964,13.553,2.4629233,1767139200,1798675200,1767139200,-0.06,316324992,2.11,2.60062,1.02,,,1.239,8.5,0.2829901,0.30140376,0.85,1779062400,EQUITY,33.38,strong_buy,1070988992,7.163,551777984,533592992,1.157,1.781,3784134912,23.99,25.264,0.06768,0.15213001,1708350976,361648736.0,544164992.0,-0.05,0.055,0.45145,0.14581001,0.12634,EUR,DLG.MI,en-US,US,Equity,Delayed Quote,False,LOW,-0.25999832,33.2 - 34.12,Milan,180617,False,POSTPOST,DE'LONGHI,De'Longhi S.p.A.,[],1776958502,False,995958000000,7.76,0.30288836,25.62 - 39.56,-6.1800003,-0.15621841,28.29901,1778599800,1778599800,1747133940.0,1747133940.0,False,2.11,2.60062,-0.9211998,-0.026856197,0.07960129,0.0023904003,20,15,MIL,finmb_5496347,Europe/Rome,CEST,7200000,it_market,False,-0.7728844,33.38,,DE'LONGHI GROUP,31100,1735603200.0,49.1,40.0,43.21111,42.0,1.44444,9.0,2.40837,13.859997,1.4 - Strong Buy,1778599800.0,7.0,5.0,4.0,8.0,4.0,1775001600.0,,TV,,,,,,,,,,,
ul. Mickiewicza 52,,Wronki,Poland,48 67 254 6100,48 67 254 0320,https://www.amica.pl,"Furnishings, Fixtures & Appliances",furnishings-fixtures-appliances,"Furnishings, Fixtures & Appliances",Consumer Cyclical,consumer-cyclical,Consumer Cyclical,"Amica S.A. engages in the production and sale of household appliances in Poland and internationally. It operates through Free-Standing Heating Appliances, Built-In Heating Appliances, Other Heating Appliances, Goods, and Other segments. The company provides freestanding cookers, built-in cookers and ovens, wine coolers, drawers, hobs, refrigerators and freezers, washing machines, dryers, dishwashers, microwaves, and kitchen goods. It offers small household appliances. In addition, the company provides space rental and maintenance services; consulting and IT services; marketing, promotional, and commercial services; hotel and catering services; and real estate management and manufacturing services. Further, it sells spare parts and materials; and trades in washing machines, heating appliances, refrigerators, microwave ovens, dishwashers, hoods, and small household appliances. Amica S.A. sells its products under the AMICA, Fagor, Hansa, GRAM, Sideme, and CDA brand names. The company was formerly known as Amica Wronki S.A. and changed its name to Amica S.A. in August 2016. Amica S.A. was founded in 1945 and is headquartered in Wronki, Poland.",2544.0,"[{'maxAge': 1, 'name': 'Mr. Jacek  Rutkowski', 'title': 'President of Management Board & CEO', 'fiscalYear': 2019, 'totalPay': 2746000, 'exercisedValue': 0, 'unexercisedValue': 0}, {'maxAge': 1, 'name': 'Mr. Michal  Rakowski', 'title': 'Vice President of Management Board of Finance', 'fiscalYear': 2019, 'totalPay': 730000, 'exercisedValue': 0, 'unexercisedValue': 0}, {'maxAge': 1, 'name': 'Mr. Robert  Stobinski', 'title': 'First Vice-President of the Management Board for Operations', 'fiscalYear': 2019, 'totalPay': 280000, 'exercisedValue': 0, 'unexercisedValue': 0}, {'maxAge': 1, 'name': 'Mr. Pawel Dominik Biel', 'title': 'Vice President of the Management Board & VP of Digitization', 'fiscalYear': 2019, 'exercisedValue': 0, 'unexercisedValue': 0}]",[],86400,2,53.0,52.5,51.4,52.6,53.0,52.5,51.4,52.6,2.0,3.77,1750118400,0.542,2.83,0.652,14.03794,9.980732,7784,7784,17350,21574,21574,51.8,52.0,,,397380800,406586532,49.65,69.5,213.9,3.16,0.16127467,54.661,57.87475,2.0,0.03773585,PLN,False,548286528,0.01149,4909954,7671444,0.34928,0.17937,7671444,133.143,0.38905534,1735603200,1767139200,1759190400,,28300000,3.69,5.19,,,,0.223,5.595,-0.1368078,0.30140376,2.0,1750118400,EQUITY,51.8,strong_buy,129200000,16.842,98000000,270900000,0.664,1.382,2464000000,26.522,321.191,0.021429999,0.0276,680099968,107750000.0,114400000.0,,-0.02,0.27601,0.03977,0.040700004,PLN,AMC.WA,en-US,US,Equity,Delayed Quote,False,LOW,-1.2000008,51.4 - 52.6,Warsaw,17350,False,POSTPOST,AMICA,Amica S.A.,[],1776956584,False,946886400000,2.1499977,0.043303076,49.65 - 69.5,-17.7,-0.25467628,-13.68078,1748257140,1748257140,1748246400.0,1748246400.0,False,3.69,5.19,-2.861,-0.052340794,-6.074749,-0.10496372,15,0,WSE,finmb_5566077,Europe/Warsaw,CEST,7200000,pl_market,False,-2.2641525,51.8,,AMICA GROUP,64-510,1577750400.0,68.1,68.1,68.1,68.1,1.0,1.0,,,1.0 - Strong Buy,,,,,,,,,,,,,,,,,,,,
BUeyUekdere Caddesi No: 199,Levent 199 Sisli,Istanbul,Turkey,90 212 456 22 00,90 212 422 02 03,https://www.vestel.com.tr,"Furnishings, Fixtures & Appliances",furnishings-fixtures-appliances,"Furnishings, Fixtures & Appliances",Consumer Cyclical,consumer-cyclical,Consumer Cyclical,"Vestel Beyaz Esya Sanayi ve Ticaret A.S. engages in the production and sale of white goods in Turkey. The company produces and sells refrigerators, room air conditioning units, washing machines, cookers, dryers, dishwashers, and water heaters. It also exports its products. The company was incorporated in 1997 and is headquartered in Istanbul, Turkey. Vestel Beyaz Esya Sanayi ve Ticaret A.S. operates as a subsidiary of Vestel Elektronik Sanayi ve Ticaret A.S.",6698.0,"[{'maxAge': 1, 'name': 'Mr. Ergun  Guler', 'age': 51, 'title': 'Chief Executive Officer', 'yearBorn': 1974, 'exercisedValue': 0, 'unexercisedValue': 0}, {'maxAge': 1, 'name': 'Mr. Bulent  Kiracioglu', 'title': 'General Manager of Finance', 'exercisedValue': 0, 'unexercisedValue': 0}, {'maxAge': 1, 'name': 'Ms. Serap  Mutlu', 'title': 'Investor Relations Director', 'exercisedValue': 0, 'unexercisedValue': 0}, {'maxAge': 1, 'name': 'Mr. Bekir Cem Koksal', 'age': 58, 'title': 'Member of Executive Committee & Director', 'yearBorn': 1967, 'exercisedValue': 0, 'unexercisedValue': 0}, {'maxAge': 1, 'name': 'Mr. Alp  Dayi', 'age': 62, 'title': 'Member of Executive Committee', 'yearBorn': 1963, 'exercisedValue': 0, 'unexercisedValue': 0}, {'maxAge': 1, 'name': 'Mr. Necmi  Kavusturan', 'age': 69, 'title': 'Member of Executive Committee', 'yearBorn': 1956, 'exercisedValue': 0, 'unexercisedValue': 0}, {'maxAge': 1, 'name': 'Mr. Erdal  Haspolat', 'age': 55, 'title': 'General Manager', 'yearBorn': 1970, 'exercisedValue': 0, 'unexercisedValue': 0}]",[],86400,2,7.46,7.47,7.32,7.53,7.46,7.47,7.32,7.53,0.04,0.6,1753315200,4.2702,2.81,0.354,,1.6123348,5796554,5796554,8380163,6493495,6493495,7.33,7.34,0.0,0.0,11712000000,11712000000,6.87,14.5,24.74,0.117562,0.15750393,7.5062,9.00745,0.0,0.0,TRY,False,34046511104,-0.08501001,362704000,1600000000,0.77331,0.01244,1600000000,22.922,0.31934386,1767139200,1798675200,1767139200,,-6321583104,-3.95,4.54,2.6,842.1053:100,1635120000.0,0.458,19.328,-0.39504135,0.30140376,0.043899,1753315200,EQUITY,7.32,none,326732992,0.204,1761540992,22661244928,0.376,0.822,74360045568,61.789,46.475,-0.01,-0.15614,5293462016,-3891323136.0,7646627840.0,,-0.361,0.07119,0.02369,-0.0629,TRY,VESBE.IS,en-US,US,Equity,Delayed Quote,False,LOW,-0.13999987,7.32 - 7.53,Istanbul,8380163,False,POSTPOST,VESTEL BEYAZ ESYA,Vestel Beyaz Esya Sanayi ve Ticaret A.S.,[],1776870481,False,1145601000000,0.4500003,0.06550223,6.87 - 14.5,-7.18,-0.4951724,-39.504135,1755169140,1755518400,,,True,-3.95,4.54,-0.18619967,-0.024806116,-1.6874499,-0.18733937,15,15,IST,finmb_25409412,Europe/Istanbul,TRT,10800000,tr_market,False,-1.8766738,7.32,,VESTEL GROUP,34394,,13.5,11.5,12.5,12.5,,2.0,0.19,38.526318,,,,,,,,,,,,,,,,,,,,,
