Philips Center,Prinses Irenestraat 59,Amsterdam,Netherlands,31 20 597 7777,,https://www.philips.com,Medical Devices,medical-devices,Medical Devices,Healthcare,healthcare,Healthcare,"Koninklijke Philips N.V. operates as a health technology company in North America, the Greater China, and internationally. It operates through Diagnosis & Treatment, Connected Care, and Personal Health segments. The company provides diagnostic imaging solutions, includes ultrasound business unit, magnetic resonance imaging, computed tomography, and diagnostic x-ray; Image Guided Therapy, including image guided therapy systems and image guided therapy devices. It also offers monitoring, enterprise informatics, and sleep and respiratory care, as well as personal health. The company was formerly known as Koninklijke Philips Electronics N.V. and changed its name to Koninklijke Philips N.V. in May 2013. Koninklijke Philips N.V. was founded in 1891 and is headquartered in Amsterdam, the Netherlands.",61085.0,"[{'maxAge': 1, 'name': 'Mr. Roy W. O. Jakobs', 'age': 51, 'title': 'President, CEO & Chairman of the Board of Management', 'yearBorn': 1974, 'fiscalYear': 2025, 'totalPay': 3197600, 'exercisedValue': 0, 'unexercisedValue': 0}, {'maxAge': 1, 'name': 'Dr. Paulus A. Stoffels M.D., Ph.D.', 'age': 63, 'title': 'Independent Vice Chairman of Supervisory Board & Secretary', 'yearBorn': 1962, 'fiscalYear': 2025, 'totalPay': 185519, 'exercisedValue': 0, 'unexercisedValue': 0}, {'maxAge': 1, 'name': 'Ms. Charlotte  Hanneman', 'age': 47, 'title': 'Executive VP, CFO & Member of Board of Management', 'yearBorn': 1978, 'fiscalYear': 2025, 'totalPay': 1668282, 'exercisedValue': 0, 'unexercisedValue': 0}, {'maxAge': 1, 'name': 'Mr. Marnix J. van Ginneken Ph.D.', 'age': 52, 'title': 'Executive VP, Chief ESG & Legal Officer and Member of the Board of Management', 'yearBorn': 1973, 'fiscalYear': 2025, 'totalPay': 1600574, 'exercisedValue': 0, 'unexercisedValue': 0}, {'maxAge': 1, 'name': 'Mr. Willem  Appelo', 'age': 61, 'title': 'Executive VP & COO', 'yearBorn': 1964, 'fiscalYear': 2025, 'exercisedValue': 0, 'unexercisedValue': 0}, {'maxAge': 1, 'name': 'Ms. Durga  Doraisamy', 'title': 'Head of Investor Relations', 'fiscalYear': 2025, 'exercisedValue': 0, 'unexercisedValue': 0}, {'maxAge': 1, 'name': 'Ms. Heidi  Sichien', 'age': 51, 'title': 'Executive VP & Chief People Officer', 'yearBorn': 1974, 'fiscalYear': 2025, 'exercisedValue': 0, 'unexercisedValue': 0}, {'maxAge': 1, 'name': 'Dr. Jan  Kimpen M.D., Ph.D.', 'age': 67, 'title': 'Chief Medical Officer', 'yearBorn': 1958, 'fiscalYear': 2025, 'exercisedValue': 0, 'unexercisedValue': 0}, {'maxAge': 1, 'name': 'Mr. Pim  Preesman', 'title': 'Country Leader/ Health Systems Leader Indonesia', 'fiscalYear': 2025, 'exercisedValue': 0, 'unexercisedValue': 0}, {'maxAge': 1, 'name': 'Mr. Henk Siebren de Jong', 'age': 61, 'title': 'Executive VP & CEO of Domestic Appliances', 'yearBorn': 1964, 'fiscalYear': 2025, 'exercisedValue': 0, 'unexercisedValue': 0}]",[],86400,2,22.83,22.33,22.02,23.44,22.83,22.33,22.02,23.44,0.85,3.72,1778544000,0.91400003,2.59,0.938,24.806452,13.505445,1851215,1851215,1571358,1767043,1767043,0.0,0.0,0.0,0.0,21946236928,21717926363,18.9,27.7,52.890896,1.623423,1.230584,25.3112,23.6327,0.85,0.037231714,EUR,False,27040925696.0,0.05019,950889393.0,951288934,0.19023001,0.47865,951288934,11.518,2.0029519,1767139200,1798675200,1767139200,,899000000,0.93,1.7082,30.2684:29.2684,1715212800.0,1.516,13.413,-0.033446252,0.12811458,0.85,1778544000,EQUITY,23.07,buy,2793999872,2.937,2016000000,8085000192,0.897,1.323,17834000384,73.574,18.807,0.03199,0.078150004,8057999872,453000000.0,1162000000.0,,0.011,0.45183,0.11304,0.1073,EUR,PHIA.AS,en-US,US,Equity,Delayed Quote,False,LOW,KON.PHILIPS N.V.,Koninklijke Philips N.V.,POSTPOST,False,False,796287600000,0.23999977,22.02 - 23.44,Amsterdam,1571358,4.17,0.22063492,18.9 - 27.7,-4.630001,-0.16714805,-3.3446252,1778085000,1778085000,1770710400.0,1770710400.0,False,0.93,1.7082,-2.2411995,-0.08854576,-0.5627003,-0.023810241,15,0,[],1774283715,AMS,finmb_185801,Europe/Amsterdam,CET,3600000,nl_market,False,1.0512474,23.07,,ROYAL PHILIPS,1077 WV,1767139200.0,35.0,22.6,28.575,28.25,2.35,20.0,2.3 - Buy,1.51953,15.182325,1778085000.0,1.0,3.0,1.0,6.0,2.0,1772323200.0,,,,,,,,,,,,,,,,,
170-180 Bourke Road,Suite 2 Ground Floor,Alexandria,Australia,61 2 9384 8100,61 2 9700 1249,https://brevillegroup.com,"Furnishings, Fixtures & Appliances",furnishings-fixtures-appliances,"Furnishings, Fixtures & Appliances",Consumer Cyclical,consumer-cyclical,Consumer Cyclical,"Breville Group Limited designs, develops, markets, and distributes small electrical kitchen appliances in the consumer products industry in the Americas, Europe, the Middle East, Africa, and the Asia Pacific. The company offers kitchen appliances, including slow cookers, kettles, and fry pans; living room, laundry, and bedroom products, such as irons, vacuums, heaters, electric blankets and fans; and other kitchen products. It operates beanz.com, an online coffee marketplace; and Breville+, a digital culinary platform. The company sells its products under the Breville, Sage, LELIT, Baratza, ChefSteps, and Kambrook brand names. Breville Group Limited was formerly known as Housewares International Limited and changed its name to Breville Group Limited in November 2008. The company was founded in 1957 and is headquartered in Alexandria, Australia.",1119.0,"[{'maxAge': 1, 'name': 'Mr. Jim  Clayton', 'title': 'MD, CEO & Director', 'fiscalYear': 2025, 'totalPay': 4067131, 'exercisedValue': 0, 'unexercisedValue': 0}, {'maxAge': 1, 'name': 'Mr. Martin Lee Nicholas ACMA, BA', 'title': 'Group Chief Financial Officer', 'fiscalYear': 2025, 'totalPay': 772161, 'exercisedValue': 0, 'unexercisedValue': 0}, {'maxAge': 1, 'name': 'Mr. Scott  Brady', 'title': 'Chief Strategy Officer', 'fiscalYear': 2025, 'totalPay': 92321, 'exercisedValue': 0, 'unexercisedValue': 0}, {'maxAge': 1, 'name': 'Mr. Mark  Payne', 'title': 'Chief Operating Officer', 'fiscalYear': 2025, 'totalPay': 806793, 'exercisedValue': 0, 'unexercisedValue': 0}, {'maxAge': 1, 'name': 'Lucy  Martyn', 'title': 'General Manager of Global Communications', 'fiscalYear': 2025, 'exercisedValue': 0, 'unexercisedValue': 0}, {'maxAge': 1, 'name': 'Ms. Sasha  Kitto F.C.A., L.L.B.', 'title': 'Joint Company Secretary', 'fiscalYear': 2025, 'exercisedValue': 0, 'unexercisedValue': 0}, {'maxAge': 1, 'name': 'Mr. Craig  Robinson A.C.M.A., B.A.', 'title': 'Joint Company Secretary', 'fiscalYear': 2025, 'exercisedValue': 0, 'unexercisedValue': 0}]",[],86400,2,26.21,25.61,25.54,26.32,26.21,25.61,25.54,26.32,0.38,1.46,1773187200,0.397,1.2,1.179,28.010752,24.082016,228434,228434,367082,501498,501498,25.5,28.0,0.0,0.0,3773044480,3796111720,24.33,37.11,39.0,0.465,2.098778,30.6804,30.71085,0.38,0.014498283,AUD,False,3889397248.0,0.07596,101234956.0,144838561,0.32149,0.31967,144838561,7.236,3.6000552,1751241600,1782777600,1767139200,0.007,136560000,0.93,1.08172,,,2.163,17.113,-0.17578614,0.12811458,0.19,1773100800,EQUITY,26.05,buy,176840992,1.221,227272992,293300000,1.218,1.98,1797734016,27.986,12.471,0.07526,0.13515,643665024,91230624.0,189203008.0,0.003,0.101,0.35804,0.12642,0.13262,AUD,BRG.AX,en-US,US,Equity,Delayed Quote,False,LOW,BREVILLE FPO [BRG],Breville Group Limited,PRE,False,False,919897200000,-0.15999985,25.54 - 26.32,ASX,367082,1.7199993,0.07069459,24.33 - 37.11,-11.060001,-0.2980329,-17.578613,1770873120,1770873120,1770847200.0,1770847200.0,False,0.93,1.08172,-4.6304016,-0.15092376,-4.6608505,-0.1517656,20,20,[],1774242602,ASX,finmb_4493503,Australia/Sydney,AEDT,39600000,au_market,False,-0.6104534,26.05,,BREVILLE GROUP,2015,1767139200.0,40.65,22.0,36.44214,37.4,1.71429,14.0,1.7 - Buy,0.94038,27.701567,1770873120.0,3.0,9.0,6.0,7.0,9.0,1772323200.0,,NSW,,,,,,,,,,,,,,,
Osaka Umeda Twin Towers South,"1-13-1, Umeda Kita-ku",Osaka,Japan,81 6 6147 3321,,https://www.daikin.com,Building Products & Equipment,building-products-equipment,Building Products & Equipment,Industrials,industrials,Industrials,"Daikin Industries,Ltd. manufactures, distributes, and sells air-conditioning and refrigeration equipment, and chemical products in Japan, the Americas, China, Asia, Europe, Europe, and internationally. It offers air-conditioning and refrigeration equipment products, such as split/multi-split typeair conditioners, unitary, air to water heat pump systems, heating systems, air purifiers, skyair, multi-split type air conditioners, ventilations, control systems, packaged air-conditioning systems, air cooled chillers, water cooled chillers, rooftops, air side equipment, refrigeration, containers, marine HVAC, and air filters. The company's chemical products comprises fluoropolymers, fluoropolymers coatings, additives, films, anti-smudge coating, coating resin, fluorinated oil, refrigerants, fluorinated liquids, etching agents, battery materials, fine chemicals and intermediates, optical adhesive, fluorocarbons, fluoroplastics, fluoroelastomers, fluoropaints, fluoro coating agents, semiconductor-etching products, and water and oil repellent agents. It also provides oil hydraulics products, including oil hydraulic pumps and valves, cooling equipment and systems, inverter hydraulic power units, hydrostatic transmissions. In addition, the company offers after sales services. It serves automotive, semiconductor manufacturing, electronics, energy solutions, home and living, building and construction, oil and gas, aerospace, and life sciences industries. Daikin Industries, Ltd. was founded in 1924 and is headquartered in Osaka, Japan.",103544.0,"[{'maxAge': 1, 'name': 'Mr. Masanori  Togawa', 'age': 76, 'title': 'CEO & Representative Chairman', 'yearBorn': 1949, 'fiscalYear': 2025, 'totalPay': 318000000, 'exercisedValue': 0, 'unexercisedValue': 0}, {'maxAge': 1, 'name': 'Naofumi  Takenaka', 'age': 61, 'title': 'President, COO & Representative Director', 'yearBorn': 1964, 'fiscalYear': 2025, 'totalPay': 136000000, 'exercisedValue': 0, 'unexercisedValue': 0}, {'maxAge': 1, 'name': 'Mr. Noriyuki  Inoue', 'age': 90, 'title': 'Chairman Emeritus & Chief Global Group Officer', 'yearBorn': 1935, 'fiscalYear': 2025, 'totalPay': 104000000, 'exercisedValue': 0, 'unexercisedValue': 0}, {'maxAge': 1, 'name': 'Mr. Koichi  Takahashi', 'age': 69, 'title': 'Senior Executive Officer, GM of Finance & Accounting Division and Director', 'yearBorn': 1956, 'fiscalYear': 2025, 'totalPay': 90000000, 'exercisedValue': 0, 'unexercisedValue': 0}, {'maxAge': 1, 'name': 'Mr. Takashi  Matsuzaki', 'age': 67, 'title': 'Senior Executive Officer', 'yearBorn': 1958, 'fiscalYear': 2025, 'totalPay': 124000000, 'exercisedValue': 0, 'unexercisedValue': 0}, {'maxAge': 1, 'name': 'Mr. Kanwal Jeet  Jawa B.E.(Mech.)., P.G.D.M', 'age': 66, 'title': 'Non-Resident Director & Senior Associate Officer', 'yearBorn': 1959, 'fiscalYear': 2025, 'totalPay': 170000000, 'exercisedValue': 0, 'unexercisedValue': 0}, {'maxAge': 1, 'name': 'Yuji  Yoneda', 'title': 'Senior Executive Officer and GM of Technology & Innovation Center', 'fiscalYear': 2025, 'exercisedValue': 0, 'unexercisedValue': 0}, {'maxAge': 1, 'name': 'Kazuhiro  Matoba', 'title': 'Department Manager of Corporate IR Group - Corporate Communication Department', 'fiscalYear': 2025, 'exercisedValue': 0, 'unexercisedValue': 0}, {'maxAge': 1, 'name': 'Nin  Sokin', 'title': 'Executive Officer & GM of Legal Affairs and Compliance Center', 'fiscalYear': 2025, 'exercisedValue': 0, 'unexercisedValue': 0}, {'maxAge': 1, 'name': 'Masaki  Saji', 'title': 'Senior Executive Officer, GM of Human Resources Div. & Dept. Manager of Diversity Promotion Group', 'fiscalYear': 2025, 'exercisedValue': 0, 'unexercisedValue': 0}]",[],86400,2,19370.0,18755.0,18465.0,18880.0,19370.0,18755.0,18465.0,18880.0,330.0,1.7,1774828800,0.33150002,1.13,0.502,20.70391,18.81343,1533000,1533000,1250194,1183640,1183640,0.0,0.0,0.0,0.0,5455401189376,5672094243400,14935.0,20915.0,31330.0,1270.0,1.13055,19428.0,18734.074,310.0,0.01600413,JPY,False,5483920883712.0,0.05666,292791591.0,292828820,0.045760002,0.54973,292828820,10767.208,1.7302536,1743379200,1774915200,1767139200,-0.018,273417994240,899.83,990.25,,,1.136,8.341,0.1458149,0.12811458,165.0,1774828800,EQUITY,18630.0,buy,985705021440,3366.071,657427988480,947987021824,1.094,1.951,4825439797248,29.449,16479.588,0.044510003,0.0929,1670397034496,,433470996480.0,-0.018,0.079,0.34616002,0.13623999,0.05163,JPY,6367.T,en-US,US,Equity,Delayed Quote,False,LOW,DAIKIN INDUSTRIES,"Daikin Industries,Ltd.",PREPRE,False,False,946944000000,-740.0,18465.0 - 18880.0,Tokyo,1250194,3695.0,0.24740542,14935.0 - 20915.0,-2285.0,-0.10925173,14.58149,1778135400,1778135400,1746701940.0,1746701940.0,True,899.83,990.25,-798.0,-0.041074738,-104.07422,-0.0055553433,15,20,"[{'header': 'Dividend', 'message': '6367.T announced a cash dividend of JPY 165.00 with an ex-date of Mar. 30, 2026', 'meta': {'eventType': 'DIVIDEND', 'dateEpochMs': 1774796400000, 'amount': '165.00'}}]",1774247400,JPX,finmb_875860,Asia/Tokyo,JST,32400000,jp_market,False,-3.8203406,18630.0,2.4065,DAIKIN INDUSTRIES,530-0001,1767139200.0,27800.0,16000.0,21855.086,22200.0,2.11765,16.0,2.1 - Buy,,,1770186600.0,1.0,4.0,1.0,6.0,3.0,1772323200.0,http://www.daikin.com/investor/index.html,,,,,,,,,,,,,,,,
Tokyo Building,"2-7-3, Marunouchi",Chiyoda,Japan,81 3 3218 2111,,https://www.mitsubishielectric.com,Electrical Equipment & Parts,electrical-equipment-parts,Electrical Equipment & Parts,Industrials,industrials,Industrials,"Mitsubishi Electric Corporation develops, manufactures, sells, and distributes electrical and electronic equipment in Japan, North America, rest of Asia, Europe, and internationally. It operates through Infrastructure, Industry & Mobility, Life, Business Platform, Semiconductor & Device, and Others segments. The company offers public utility systems comprising rolling stock and communication systems, and supervisory control and power supply systems; energy systems consisting of power transmission and distribution systems and power demand and supply optimization solutions; and defense and space systems, including missile and radar systems, command and control systems, electric warfare and satellite systems, and satellite data solutions. It also provides factory automation (FA) systems, such as control and drive products, processing machines, power distribution control equipment, and FA digital solutions; automotive equipment comprising electric vehicle-related equipment, ADAS-related products, vehicle control systems, and powertrain products; building systems consisting of elevators, escalators, and building management systems; and air conditioning and refrigeration systems, lighting, ventilation, and home equipment and appliances. In addition, the company offers information systems and network services related to manufacturing dx solutions; IT infrastructure; and security solutions. Further, it provides semiconductor and device products, including power and high-frequency devices, and optical devices, as well as procurement, real estate leasing and brokerage, advertising, and finance services. Additionally, the company offers energy and facility, OT security, and CVC solutions; data center and information systems outsourcing services; software, control panels, switchboards, printed circuit boards, and generators; electrical construction services; and repair services. Mitsubishi Electric Corporation was incorporated in 1921 and is headquartered in Chiyoda, Japan.",149914.0,"[{'maxAge': 1, 'name': 'Mr. Kei  Uruma', 'age': 66, 'title': 'Representative Executive Officer, President, CEO & Director', 'yearBorn': 1959, 'fiscalYear': 2025, 'totalPay': 265000000, 'exercisedValue': 0, 'unexercisedValue': 0}, {'maxAge': 1, 'name': 'Tomonori  Sato', 'age': 58, 'title': 'Executive Officer, CTO and Group President of Defense & Space Systems', 'yearBorn': 1967, 'fiscalYear': 2025, 'totalPay': 56000000, 'exercisedValue': 0, 'unexercisedValue': 0}, {'maxAge': 1, 'name': 'Mr. Satoshi  Takeda', 'age': 58, 'title': 'Senior VP, Chief Digital & Information Officer, Group President of Digital Innovation and Director', 'yearBorn': 1967, 'fiscalYear': 2025, 'totalPay': 69000000, 'exercisedValue': 0, 'unexercisedValue': 0}, {'maxAge': 1, 'name': 'Yasunari  Abe', 'age': 59, 'title': 'Executive Officer, Chief Human Resources Officer & Public Relations', 'yearBorn': 1966, 'fiscalYear': 2025, 'totalPay': 65000000, 'exercisedValue': 0, 'unexercisedValue': 0}, {'maxAge': 1, 'name': 'Mr. Satoshi  Kusakabe', 'age': 65, 'title': 'Senior VP, Chief Risk Officer & External Relations', 'yearBorn': 1960, 'fiscalYear': 2025, 'totalPay': 81000000, 'exercisedValue': 0, 'unexercisedValue': 0}, {'maxAge': 1, 'name': 'Mr. Kunihiko  Kaga', 'age': 61, 'title': 'Rep Exec Officer, SVP, Industry & Mobility Bus Area Owner and Sr. Gen Manager', 'yearBorn': 1964, 'fiscalYear': 2025, 'totalPay': 74000000, 'exercisedValue': 0, 'unexercisedValue': 0}, {'maxAge': 1, 'name': 'Mr. Noriyuki  Takazawa', 'age': 63, 'title': 'Representative Executive Officer, SVP, Chief Strategy Officer & Director', 'yearBorn': 1962, 'fiscalYear': 2025, 'totalPay': 82000000, 'exercisedValue': 0, 'unexercisedValue': 0}, {'maxAge': 1, 'name': 'Yoshikazu  Nakai', 'age': 64, 'title': 'Executive Officer and Chief Productivity & Quality Officer', 'yearBorn': 1961, 'fiscalYear': 2025, 'totalPay': 62000000, 'exercisedValue': 0, 'unexercisedValue': 0}, {'maxAge': 1, 'name': 'Mr. Kenichiro  Fujimoto', 'age': 61, 'title': 'Executive Officer, CFO & Director', 'yearBorn': 1964, 'fiscalYear': 2025, 'exercisedValue': 0, 'unexercisedValue': 0}, {'maxAge': 1, 'name': 'Yoshihide  Asakura', 'title': 'Executive Officer and VP of Corporate Finance & Accounting', 'fiscalYear': 2025, 'exercisedValue': 0, 'unexercisedValue': 0}]",[],86400,2,5483.0,5183.0,5069.0,5237.0,5483.0,5183.0,5069.0,5237.0,55.0,1.0,1774828800,0.2886,2.2,0.525,26.958755,31.149328,7279000,7279000,6456932,5783310,5783310,0.0,0.0,0.0,0.0,10526416437248,11220128359445,2267.0,6060.0,6060.0,250.0,1.8541008,5336.5,4159.0425,55.0,0.010031005,JPY,False,10326614474752.0,0.06592,1955459226.0,2046348415,0.02949,0.49725,2046348415,2029.234,2.5349467,1743379200,1774915200,1767139200,-0.159,374254993408,190.81,165.14,,,1.819,19.415,0.91278565,0.12811458,30.0,1774828800,EQUITY,5144.0,buy,719239970816,350.668,531894009856,355438985216,1.135,1.988,5677370048512,8.262,2768.019,0.0357,0.09513,1792980025344,252386869248.0,490673012736.0,-0.149,0.049,0.31581,0.09369001,0.049450003,JPY,6503.T,en-US,US,Equity,Delayed Quote,False,LOW,MITSUBISHI ELECTRIC CORP,Mitsubishi Electric Corporation,PREPRE,False,False,946944000000,-339.0,5069.0 - 5237.0,Tokyo,6456932,2877.0,1.2690781,2267.0 - 6060.0,-916.0,-0.15115511,91.278564,1777357800,1777357800,1745837940.0,1745837940.0,True,190.81,165.14,-192.5,-0.036072332,984.9575,0.23682314,15,20,"[{'header': 'Dividend', 'message': '6503.T announced a cash dividend of JPY 30.00 with an ex-date of Mar. 30, 2026', 'meta': {'eventType': 'DIVIDEND', 'dateEpochMs': 1774796400000, 'amount': '30.00'}}]",1774247400,JPX,finmb_873902,Asia/Tokyo,JST,32400000,jp_market,False,-6.1827464,5144.0,3.173,MITSUBISHI ELECTRIC,100-8310,1767139200.0,7000.0,2800.0,5464.933,5900.0,1.86667,15.0,1.9 - Buy,,,1770100200.0,1.0,1.0,5.0,8.0,1.0,1772323200.0,http://www.mitsubishielectric.com/company/ir/index.html,,,,,,,,,,,,,,,,
"6-6, Marunouchi 1-chome",Chiyoda-ku,Tokyo,Japan,81 3 3258 1111,,https://www.hitachi.com/ja-jp,Conglomerates,conglomerates,Conglomerates,Industrials,industrials,Industrials,"Hitachi, Ltd. provides digital system and services, green energy and mobility, and connective industry solutions in Japan and internationally. It operates through Digital Systems & Services, Green Energy & Mobility, Connective Industries, and Others segments. The company offers system integration, consulting, cloud services, storage, servers, software, and ATMs; finance solutions, social infrastructure information systems, public IT solutions, industrial internet of things, digital engineering, control system, and cloud services; and IT products, such as data management and storage. It also provides power grids, clean, nuclear, renewable energy, and railway systems, such as rolling stock, signaling, supervision, telecommunications, and ticketing and payment solutions; automotive automation, including automotive assembly, glass applications, press automation, powertrain, paint and sealer applications, and tyre and wheel systems; and emobility solutions, as well as elevators and escalators, home appliances, air conditioners, industry and distribution solution, water and environment solutions, and industrial machinery. In addition, the company offers semiconductor manufacturing equipment; electron microscopes and atomic force microscopes; analytical systems, such as spectrophotometers, thermal analysis and chromatography systems, x-ray fluorescence analyzers, silicon drift detectors, potentiometric titrator, laser induced breakdown spectroscopy, and magnetic induction devices; clinical analyzers, and treatment and diagnostics solutions; and property management and other services. The company serves semiconductors, automotive , electrical, chemical and pharmaceuticals, healthcare, life-sciences, ICT, metals and mining, engineering and manufacturing, oils and petrochemicals, nonmetal materials, energy and batteries, environment, recycling, food and beverage, utilities, and other industries. Hitachi, Ltd. was founded in 1910 and is headquartered in Tokyo, Japan.",282743.0,"[{'maxAge': 1, 'name': 'Mr. Toshiaki  Higashihara', 'age': 70, 'title': 'Executive Chairman & Representative Executive Officer', 'yearBorn': 1955, 'fiscalYear': 2025, 'totalPay': 267000000, 'exercisedValue': 0, 'unexercisedValue': 0}, {'maxAge': 1, 'name': 'Mr. Toshiaki  Tokunaga', 'age': 58, 'title': 'President, CEO, Representative Executive Officer & Director', 'yearBorn': 1967, 'fiscalYear': 2025, 'totalPay': 165000000, 'exercisedValue': 0, 'unexercisedValue': 0}, {'maxAge': 1, 'name': 'Tomomi  Kato', 'age': 62, 'title': 'Rep. Executive Officer, SVP, CFO, CRMO & GM of Finance Division & Finance Group', 'yearBorn': 1963, 'fiscalYear': 2025, 'totalPay': 112000000, 'exercisedValue': 0, 'unexercisedValue': 0}, {'maxAge': 1, 'name': 'Mr. Seiichiro  Nukui', 'age': 60, 'title': 'VP, Executive Officer, CIO & GM of IT Strategy and Digital Integration Division', 'yearBorn': 1965, 'fiscalYear': 2025, 'totalPay': 75000000, 'exercisedValue': 0, 'unexercisedValue': 0}, {'maxAge': 1, 'name': 'Mr. Masahiko  Hasegawa', 'age': 61, 'title': 'Representative Exe. Officer, Senior VP, CMO & Head of Regional Strategies - Japan/ China', 'yearBorn': 1964, 'fiscalYear': 2025, 'totalPay': 109000000, 'exercisedValue': 0, 'unexercisedValue': 0}, {'maxAge': 1, 'name': 'Ms. Lorena  Dellagiovanna', 'age': 56, 'title': 'Senior VP, Executive Officer, Chief Sustainability Officer, CHRO, GM of Human Capital & CDEIO', 'yearBorn': 1969, 'fiscalYear': 2025, 'totalPay': 545000000, 'exercisedValue': 0, 'unexercisedValue': 0}, {'maxAge': 1, 'name': 'Mr. Katsuya  Nagano', 'age': 67, 'title': 'SVP, Executive Officer, Head of Digital Systems & Services Japan, CEO of Social Infrastructure Sys', 'yearBorn': 1958, 'fiscalYear': 2025, 'totalPay': 114000000, 'exercisedValue': 0, 'unexercisedValue': 0}, {'maxAge': 1, 'name': 'Dr. Brice  Koch', 'age': 61, 'title': 'Rep. Executive Officer, EVP, Assistant to the President & Head of Connective Industries Business', 'yearBorn': 1964, 'fiscalYear': 2025, 'totalPay': 525000000, 'exercisedValue': 0, 'unexercisedValue': 0}, {'maxAge': 1, 'name': 'Mr. Jun  Abe', 'age': 64, 'title': 'EVP, Head of Digital Systems & Services Business CEO of Digital Engineering & AI Solutions Business', 'yearBorn': 1961, 'fiscalYear': 2025, 'totalPay': 151000000, 'exercisedValue': 0, 'unexercisedValue': 0}, {'maxAge': 1, 'name': 'Mr. Kojin  Nakakita', 'age': 62, 'title': 'VP & Exec Off, Head of Regional Strategies [APAC/India]', 'yearBorn': 1963, 'fiscalYear': 2025, 'totalPay': 124000000, 'exercisedValue': 0, 'unexercisedValue': 0}]",[],86400,2,4849.0,4730.0,4636.0,4844.0,4849.0,4730.0,4636.0,4844.0,45.0,0.93,1759104000,0.2693,1.5,0.353,28.69269,26.946611,14999900,14999900,15184698,14162680,14162680,0.0,0.0,0.0,0.0,21650733006848,21871752388018,2590.0,6039.0,6039.0,227.0,2.1073437,5110.86,4595.905,45.0,0.009280264,JPY,False,21438289412096.0,0.08015,4280554594.0,4510569682,0.01708,0.48951,4510569682,1405.56,3.4150088,1743379200,1774915200,1767139200,0.196,823499030528,167.29,178.13,5:1,1719446400.0,2.087,13.559,0.29583108,0.12811458,23.0,1759104000,EQUITY,4800.0,strong_buy,1522984026112,336.767,1581140934656,1056250986496,0.742,1.083,10273944502272,16.116,2254.761,,,3050283991040,,1715977060352.0,0.213,0.101,0.2969,0.1539,0.11703,JPY,6501.T,en-US,US,Equity,Delayed Quote,False,LOW,HITACHI,"Hitachi, Ltd.",PREPRE,False,False,946944000000,-49.0,4636.0 - 4844.0,Tokyo,15184698,2210.0,0.85328186,2590.0 - 6039.0,-1239.0,-0.20516641,29.583109,1777357800,1777357800,1745825400.0,1745825400.0,True,167.29,178.13,-310.85986,-0.0608234,204.09521,0.04440806,15,20,[],1774247400,JPX,finmb_142747,Asia/Tokyo,JST,32400000,jp_market,False,-1.0105176,4800.0,,HITACHI LTD,100-8280,1767139200.0,6700.0,4600.0,5869.231,6000.0,1.46154,13.0,1.5 - Strong Buy,,,1769668200.0,1.0,1.0,5.0,5.0,1.0,1772323200.0,http://www.hitachi.com/IR-e/index.html,,,,,,,,,,,,,,,,
