LG Twin Tower 128,Yeoui-daero Yeongdeungpo-gu,Seoul,South Korea,82 2 3777 1114,82 2 3777 3428,https://www.lge.co.kr,Consumer Electronics,consumer-electronics,Consumer Electronics,Technology,technology,Technology,"LG Electronics Inc., together with its subsidiaries, manufactures and sells consumer and commercial products in South Korea and internationally. It operates through the Home Appliance & Air Solution, Home Entertainment, Vehicle Component Solutions, Business Solutions, LG Innotek Co., Ltd. (Innotek), and Other segments. The Home Appliance & Air Solution segment provides refrigerators, washing machines, vacuum cleaners, and residential and commercial air conditioners. Its Home Entertainment segment offers televisions and digital media products. The Vehicle Component Solutions segment designs and manufactures automobile parts. Its Business Solutions segment provides monitors, PCs, information displays, and other products. The Innotek segment offers optics solutions, substrate materials, and automotive components, as well as camera modules and motors/sensors. Its Other segment engages in equipment production and other activities. The company was formerly known as GoldStar and changed its name to LG Electronics Inc. in 1995. LG Electronics Inc. was founded in 1958 and is headquartered in Seoul, South Korea.",,"[{'maxAge': 1, 'name': 'Mr. Jae-cheol  Lyu', 'age': 36, 'title': 'CEO & Director', 'yearBorn': 1989, 'fiscalYear': 2024, 'totalPay': 2617000000, 'exercisedValue': 0, 'unexercisedValue': 0}, {'maxAge': 1, 'name': 'Mr. Chang-Tae  Kim', 'title': 'CFO, Chief Risk Management Officer & Inside Director', 'fiscalYear': 2024, 'totalPay': 722970000, 'exercisedValue': 0, 'unexercisedValue': 0}, {'maxAge': 1, 'name': 'Mr. Joo-Wan  Cho', 'title': 'Chief Strategy Officer & Executive Director', 'fiscalYear': 2024, 'totalPay': 2992000000, 'exercisedValue': 0, 'unexercisedValue': 0}, {'maxAge': 1, 'name': 'Mr. Hyoung-Sei  Park', 'title': 'President of Home Entertainment', 'fiscalYear': 2024, 'totalPay': 1749000000, 'exercisedValue': 0, 'unexercisedValue': 0}, {'maxAge': 1, 'name': 'Seok-hyun  Eun', 'title': 'President', 'fiscalYear': 2024, 'exercisedValue': 0, 'unexercisedValue': 0}, {'maxAge': 1, 'name': 'James  Lee', 'title': 'President', 'fiscalYear': 2024, 'exercisedValue': 0, 'unexercisedValue': 0}, {'maxAge': 1, 'name': 'Dr. Byoung-hoon  Kim', 'title': 'Executive VP & CTO', 'fiscalYear': 2024, 'exercisedValue': 0, 'unexercisedValue': 0}, {'maxAge': 1, 'name': 'Mr. Sang-Gyu  Choi', 'age': 69, 'title': 'Head of Korea Sales Division', 'yearBorn': 1956, 'fiscalYear': 2024, 'exercisedValue': 0, 'unexercisedValue': 0}, {'maxAge': 1, 'name': 'Mr. Soon-Kook  Hong', 'age': 65, 'title': 'Director of Material/ Production Technology Institute', 'yearBorn': 1960, 'fiscalYear': 2024, 'exercisedValue': 0, 'unexercisedValue': 0}, {'maxAge': 1, 'name': 'Mr. Sang-Bong  Lee', 'age': 68, 'title': 'Head of Energy Business Center', 'yearBorn': 1957, 'fiscalYear': 2024, 'exercisedValue': 0, 'unexercisedValue': 0}]",[],86400,2,132800.0,0.0,0.0,0.0,132800.0,0.0,0.0,0.0,1350.0,1.02,1774828800,0.18620001,0.92,1.275,,10.163089,0,0,1488491,777717,777717,0.0,0.0,0.0,0.0,23390565957632,22608695839500,0.0,151900.0,193000.0,27865.54,0.26222348,119000.0,94128.5,,,KRW,False,33219351150592,0.0107700005,122536671,162884638,0.35311002,0.24836999,180065937,,,1767139200,1798675200,1767139200,,968125972480,,,,,,0.372,5.463,0.8890469,0.30140376,850.0,1774828800,EQUITY,129900.0,buy,8796182151168,48849.78,6080427982848,13960335065088,0.759,1.28,89200883924992,48.894,495379.0,0.02308,0.045679998,20841658056704,1445404737536.0,4280500092928.0,,0.048,0.23365,0.068169996,-0.00457,KRW,066570.KS,en-US,US,Equity,Delayed Quote,False,LOW,-2900.0,0.0 - 0.0,KSE,1488491,False,PREPRE,LGELECTRONICS,LG Electronics Inc.,[],1776925810,False,1019606400000,129900.0,,0.0 - 151900.0,-22000.0,-0.14483212,88.90469,1777442400,1777442400,1777446000.0,1777446000.0,False,,,10900.0,0.09159664,35771.5,0.38002837,20,20,KSC,finmb_877066,Asia/Seoul,KST,32400000,kr_market,False,-2.183735,129900.0,,LG ELECTRONICS,07336,1735603200.0,170000.0,85000.0,129230.766,130000.0,1.69231,26.0,11232.662,11.564489,1.7 - Buy,1777442400.0,1.0,6.0,1.0,6.0,5.0,1775001600.0,http://www.lg.com/global/investor-relations,,,,,,,,,,,,
S:t Goransgatan 143,Stadshagen,Stockholm,Sweden,46 87 38 60 00,,https://www.electroluxgroup.com,"Furnishings, Fixtures & Appliances",furnishings-fixtures-appliances,"Furnishings, Fixtures & Appliances",Consumer Cyclical,consumer-cyclical,Consumer Cyclical,"AB Electrolux (publ), together with its subsidiaries, develops, manufactures, and sells household appliances. The company offers a range of appliances, such as refrigerators, freezers, cookers, dishwashers, dryers, washing machines, air-conditioners, microwave ovens, vacuum cleaners, water heaters, heat pumps, and other small domestic appliances, as well as consumables and accessories. It also provides hobs, ovens, hoods, and tumble dryers. In addition, the company offers product installation, repair, and maintenance services. It provides its products under the Electrolux, AEG, and Frigidaire brand names through retailers, buying groups, independent stores, and direct to consumers. It operates in the United States, Brazil, Germany, Australia, Canada, Switzerland, the United Kingdom, Italy, France, Sweden, and internationally. AB Electrolux (publ) was founded in 1901 and is headquartered in Stockholm, Sweden.",39796.0,"[{'maxAge': 1, 'name': 'Mr. Yannick  Fierling', 'age': 54, 'title': 'President, CEO & Director', 'yearBorn': 1971, 'fiscalYear': 2025, 'totalPay': 26750000, 'exercisedValue': 0, 'unexercisedValue': 0}, {'maxAge': 1, 'name': 'Ms. Therese  Friberg', 'age': 50, 'title': 'Chief Financial Officer', 'yearBorn': 1975, 'fiscalYear': 2025, 'exercisedValue': 0, 'unexercisedValue': 0}, {'maxAge': 1, 'name': 'Jens-Petter  Iversen', 'age': 61, 'title': 'Chief Information Officer', 'yearBorn': 1964, 'fiscalYear': 2025, 'exercisedValue': 0, 'unexercisedValue': 0}, {'maxAge': 1, 'name': 'Mr. Ann-Sofi  Jönsson', 'title': 'Head of Investor Relations & Sustainability Reporting', 'fiscalYear': 2025, 'exercisedValue': 0, 'unexercisedValue': 0}, {'maxAge': 1, 'name': 'Mr. Nikos  Bartzoulianos', 'title': 'CMO & Head of Sustainability - BA EA', 'fiscalYear': 2025, 'exercisedValue': 0, 'unexercisedValue': 0}, {'maxAge': 1, 'name': 'Ms. Francesca  Morichini', 'age': 47, 'title': 'Chief HR & Communication Officer', 'yearBorn': 1978, 'fiscalYear': 2025, 'exercisedValue': 0, 'unexercisedValue': 0}, {'maxAge': 1, 'name': 'Ms. Pernilla  Johansson', 'title': 'Head of Design', 'fiscalYear': 2025, 'exercisedValue': 0, 'unexercisedValue': 0}, {'maxAge': 1, 'name': 'Leandro  Jasiocha', 'age': 49, 'title': 'Head of Region Europe, Middle East Africa (EMEA)', 'yearBorn': 1976, 'fiscalYear': 2025, 'exercisedValue': 0, 'unexercisedValue': 0}, {'maxAge': 1, 'name': 'Elena  Breda', 'age': 52, 'title': 'SVP of Product Strategy, Innovation & Sustainability', 'yearBorn': 1973, 'fiscalYear': 2025, 'exercisedValue': 0, 'unexercisedValue': 0}, {'maxAge': 1, 'name': 'Ms. Michelle  Shi-Verdaasdonk', 'age': 45, 'title': 'Chief Product Officer', 'yearBorn': 1980, 'fiscalYear': 2025, 'exercisedValue': 0, 'unexercisedValue': 0}]",[],86400,2,58.68,59.04,58.84,60.7,58.68,59.04,58.84,60.7,,,1714089600,0.0,4.42,1.199,18.90282,5.970297,1947821,1947821,1800899,2201631,2201631,60.34,60.32,0.0,0.0,16310928384,15883537121,50.34,88.4,261.3,42.894558,0.124243446,66.7012,61.8632,0.0,0.0,SEK,False,43834724352,0.00669,220925163,262304514,0.00089,0.48854,270496318,32.163,1.8748252,1767139200,1798675200,1767139200,2.107,878000000,3.19,10.1,1.02,5:1,896745600.0,0.334,6.425,-0.20010906,0.30140376,4.6,1664409600,EQUITY,60.3,hold,15820999680,58.489,6822000128,43776999424,0.632,0.962,131282001920,502.837,485.531,0.01555,0.09528,21702000640,-1877500032.0,1176999936.0,2.043,-0.075,0.16531,0.051960003,0.02409,SEK,ELUX-B.ST,en-US,US,Equity,Delayed Quote,True,HIGH,1.6199989,58.84 - 60.7,Stockholm,1800899,False,POSTPOST,"Electrolux, AB ser. B",AB Electrolux (publ),[],1776958180,False,946886400000,9.959999,0.19785456,50.34 - 88.4,-28.100002,-0.31787333,-20.010906,1776958200,1776958200,1777014000.0,1777014000.0,False,3.19,10.1,-6.401203,-0.095968336,-1.5632019,-0.025268687,15,0,STO,finmb_526391,Europe/Stockholm,CEST,7200000,se_market,False,2.7607343,60.3,,ELECTROLUX GROUP,105 45,1767139200.0,103.0,50.0,69.0,70.0,3.0,11.0,7.92636,7.6075273,3.0 - Hold,1776958200.0,7.0,2.0,1.0,8.0,1.0,1775001600.0,,,,,,,,,,,,,
"No. 8, Ronggang Road",Ronggui Street Shunde District,Foshan,China,86 757 2836 2570,86 757 2836 1055,https://hxjd.hisense.cn,"Furnishings, Fixtures & Appliances",furnishings-fixtures-appliances,"Furnishings, Fixtures & Appliances",Consumer Cyclical,consumer-cyclical,Consumer Cyclical,"Hisense Home Appliances Group Co., Ltd., together with its subsidiaries, engages in the research, development, manufacture, marketing, and servicing of home appliances in the People's Republic of China and internationally. It operates through Air Conditioning Unit, Ice Cleaning Equipment, and Others segments. The company offers HVAC systems, refrigerators, residential air conditioners, central air conditioners, freezers, washing machines, kitchen appliances, molds, automotive air conditioning compressors, and automotive integrated thermal management systems, as well as comprehensive smart home solutions. It sells its products under the Hisense, Ronshen, Kelon, Hitachi, York, Gorenje, ASKO, and Sanden brands through its online store. In addition, the company engages in investing activities. The company was formerly known as Hisense Kelon Electrical Holdings Company Limited and changed its name to Hisense Home Appliances Group Co., Ltd. in October 2018. Hisense Home Appliances Group Co., Ltd. was founded in 1984 and is headquartered in Foshan, the People's Republic of China.",37759.0,"[{'maxAge': 1, 'name': 'Ms. Yu Ling  Gao', 'age': 44, 'title': 'President & Executive Chairman', 'yearBorn': 1981, 'fiscalYear': 2024, 'totalPay': 2704853, 'exercisedValue': 0, 'unexercisedValue': 0}, {'maxAge': 1, 'name': 'Mr. Chang Chun  Sun', 'age': 41, 'title': 'Chief Financial Officer', 'yearBorn': 1984, 'fiscalYear': 2024, 'exercisedValue': 0, 'unexercisedValue': 0}, {'maxAge': 1, 'name': 'Mr. Shaoqian  Jia', 'age': 52, 'title': 'Executive Director', 'yearBorn': 1973, 'fiscalYear': 2024, 'exercisedValue': 0, 'unexercisedValue': 0}, {'maxAge': 1, 'name': 'Mr. Huizhong  Dai', 'age': 59, 'title': 'Executive Director', 'yearBorn': 1966, 'fiscalYear': 2024, 'totalPay': 5480298, 'exercisedValue': 0, 'unexercisedValue': 0}, {'maxAge': 1, 'name': 'Mr. Zhi Tao  Yu', 'age': 49, 'title': 'Executive Director', 'yearBorn': 1976, 'fiscalYear': 2024, 'exercisedValue': 0, 'unexercisedValue': 0}, {'maxAge': 1, 'name': 'Ms. De Fang  Huang', 'age': 58, 'title': 'Company Secretary', 'yearBorn': 1967, 'fiscalYear': 2024, 'exercisedValue': 0, 'unexercisedValue': 0}, {'maxAge': 1, 'name': 'Ms. Yuxin  Zhang', 'age': 38, 'title': 'Board Secretary', 'yearBorn': 1987, 'fiscalYear': 2024, 'exercisedValue': 0, 'unexercisedValue': 0}, {'maxAge': 1, 'name': 'Zhou  Shan', 'title': 'Accounting Supervisor', 'fiscalYear': 2024, 'exercisedValue': 0, 'unexercisedValue': 0}, {'maxAge': 1, 'name': 'Ms. Xue Yu  Fang', 'age': 51, 'title': 'Executive Director', 'yearBorn': 1974, 'fiscalYear': 2024, 'exercisedValue': 0, 'unexercisedValue': 0}, {'maxAge': 1, 'name': 'Ms. Tak Fong  Wong', 'age': 57, 'title': 'Company Secretary', 'yearBorn': 1968, 'fiscalYear': 2024, 'exercisedValue': 0, 'unexercisedValue': 0}]",[],86400,3,21.34,21.42,20.54,21.44,21.34,21.42,20.54,21.44,1.35,6.31,1751241600,0.5282,3.94,0.676,7.738806,6.81971,4958000,4958000,857170,696285,696285,20.72,20.74,0.0,0.0,28722020352,33813707628,19.53,28.65,39.5,0.43,0.32665205,22.1764,23.3908,1.265,0.05927835,HKD,False,7054295040,0.03624,563916241,459589808,0.38477,0.12470999,1384861171,14.510103,1.4293488,1767139200,1798675200,1767139200,-0.325,3186573824,2.68,3.0411851,0.88,,,0.08,1.31,-0.120000005,0.30140376,1.346764,1751241600,EQUITY,20.74,buy,29356535808,21.21,5386012160,3652786432,0.942,1.13,87928487936,16.974,64.293,0.03703,0.23150998,18630008832,3025246976.0,5796028928.0,-0.334,-0.26,0.21188,0.06125,0.02434,CNY,0921.HK,en-US,US,Equity,Delayed Quote,False,LOW,-0.6000004,20.54 - 21.44,HKSE,857170,False,PREPRE,HISENSE HA,"Hisense Home Appliances Group Co., Ltd.",[],1776931690,False,946949400000,1.2099991,0.061955918,19.53 - 28.65,-7.91,-0.27609074,-12.0,1756551540,1757160000,,,True,2.68,3.0411851,-1.4363995,-0.06477154,-2.6508007,-0.11332663,15,15,HKG,finmb_108683,Asia/Hong_Kong,HKT,28800000,hk_market,False,-2.811623,20.74,0.8802,HISENSE GROUP,528303,1735603200.0,30.182156,20.945366,25.815758,25.505838,1.6,5.0,2.33236,8.892281,1.6 - Buy,,6.0,7.0,4.0,5.0,4.0,1775001600.0,,,,,,,,,,,,,
2000 North M-63,,Benton Harbor,United States,(269) 923-5000,,https://www.whirlpoolcorp.com,"Furnishings, Fixtures & Appliances",furnishings-fixtures-appliances,"Furnishings, Fixtures & Appliances",Consumer Cyclical,consumer-cyclical,Consumer Cyclical,"Whirlpool Corporation manufactures and markets home appliances and related products and services in the North America, Latin America, and internationally. The company's principal products include refrigerators, freezers, ice makers, and refrigerator water filters; laundry appliances, and commercial laundry products and related laundry accessories; cooking and other small domestic appliances; and dishwasher appliances and related accessories, as well as mixers. It markets and distributes its products primarily under the Whirlpool, Maytag, KitchenAid, JennAir, Consul, Brastemp, Amana, InSinkErator, affresh, Gladiator, Swash, everydrop, Eslabon de Lujo, and Acros brands. The company sells its products to retailers, distributors, builders, and other manufacturers, as well as directly to consumers. Whirlpool Corporation was founded in 1911 and is headquartered in Benton Harbor, Michigan.",41000.0,"[{'maxAge': 1, 'name': 'Mr. Marc Robert Bitzer', 'age': 60, 'title': 'Chairman & CEO', 'yearBorn': 1965, 'fiscalYear': 2025, 'totalPay': 2817886, 'exercisedValue': 0, 'unexercisedValue': 0}, {'maxAge': 1, 'name': 'Ms. Carey L. Martin', 'age': 48, 'title': 'Executive VP and Chief HR, Corporate Relations & Business Services Officer', 'yearBorn': 1977, 'fiscalYear': 2025, 'totalPay': 1146275, 'exercisedValue': 0, 'unexercisedValue': 0}, {'maxAge': 1, 'name': 'Mr. Juan Carlos Puente', 'age': 50, 'title': 'Executive President of North America & Global Strategic Sourcing', 'yearBorn': 1975, 'fiscalYear': 2025, 'totalPay': 2566216, 'exercisedValue': 0, 'unexercisedValue': 0}, {'maxAge': 1, 'name': 'Ms. Roxanne L. Warner', 'age': 42, 'title': 'Executive VP & CFO', 'yearBorn': 1983, 'fiscalYear': 2025, 'exercisedValue': 0, 'unexercisedValue': 0}, {'maxAge': 1, 'name': 'Mr. Todd  Tomczak', 'age': 44, 'title': 'Principal Accounting Officer, VP & Controller', 'yearBorn': 1981, 'fiscalYear': 2025, 'exercisedValue': 0, 'unexercisedValue': 0}, {'maxAge': 1, 'name': 'Mr. Scott  Cartwright', 'title': 'Head of Investor Relations', 'fiscalYear': 2025, 'exercisedValue': 0, 'unexercisedValue': 0}, {'maxAge': 1, 'name': 'Kyle De Jong', 'age': 45, 'title': 'Executive Vice President & Chief Legal Officer', 'yearBorn': 1980, 'fiscalYear': 2025, 'exercisedValue': 0, 'unexercisedValue': 0}, {'maxAge': 1, 'name': 'Mr. Ludovic  Beaufils', 'age': 52, 'title': 'Executive President of KitchenAid Small Appliances, Latin America, Global Information Tech. & Design', 'yearBorn': 1973, 'fiscalYear': 2025, 'exercisedValue': 0, 'unexercisedValue': 0}, {'maxAge': 1, 'name': 'Ms. Bridget K. Quinn', 'title': 'Deputy General Counsel & Corporate Secretary', 'fiscalYear': 2025, 'exercisedValue': 0, 'unexercisedValue': 0}]",[],86400,2,55.65,55.75,52.9,56.7295,55.65,55.75,52.9,56.7295,4.45,8.0,1772150400,0.9364,5.43,1.264,9.568021,8.801025,2554415,2554415,2806965,2190230,2190230,53.68,53.74,100.0,100.0,3489677824,3586013655,50.41,111.96,257.68,5.5,0.22479244,63.0222,77.40285,5.3,0.0952381,USD,False,9821265920,0.020480001,52617213,64438700,0.0072500003,0.87236,64438700,48.679,1.112492,1767139200,1798675200,1767139200,,318000000,5.66,6.15326,1.04,2:1,536544000.0,0.633,9.471,-0.29530203,0.30140376,0.9,1772150400,EQUITY,54.155,hold,669000000,11.837,1037000000,7356000256,0.299,0.756,15523999744,270.939,277.214,0.02724,0.120749995,2385999872,-133125000.0,470000000.0,,-0.009,0.1537,0.0668,0.03416,USD,WHR,en-US,US,Equity,Nasdaq Real Time Price,True,HIGH,-1.4950027,52.9 - 56.7295,NYSE,2806965,False,REGULAR,Whirlpool Corporation,Whirlpool Corporation,[],1776970951,True,99153000000,3.744999,0.0742908,50.41 - 111.96,-57.805,-0.5163005,-29.530203,1778097600,1778097600,1778155200.0,1778155200.0,False,5.66,6.15326,-8.867203,-0.14069967,-23.247849,-0.30034876,15,0,NYQ,finmb_314515,America/New_York,EDT,-14400000,us_market,False,-2.6864378,54.155,,WHIRLPOOL CORPORATION,49022-2692,1767139200.0,137.0,37.0,70.9,68.5,3.0,10.0,4.84167,11.18519,3.0 - Hold,1778097600.0,1.0,3.0,8.0,2.0,3.0,1775001600.0,http://investors.whirlpoolcorp.com/,MI,72688.0,11205034.0,1772150400.0,1774915200.0,0.0011,0.02,0.0013,1774483200.0,Whirlpool,,
1006 Kadoma,,Kadoma,Japan,81 6 6908 1121,,https://holdings.panasonic,Consumer Electronics,consumer-electronics,Consumer Electronics,Technology,technology,Technology,"Panasonic Holdings Corporation, together with its subsidiaries, research, develops, manufactures, sells, and services various electrical and electronic products in Japan, the United States, Europe, Asia, China, and internationally. It operates through five segments: Lifestyle, Automotive, Connect, Industry, and Energy. The company offers refrigerators, microwave ovens, rice cookers, washing machines, vacuum cleaners, air-conditioners, air to water heat pump system, air purifiers, showcases, as well as ventilation and perflation and air-conditioning equipment. It also provides personal-care products; lighting fixtures, lamps, wiring devices, solar photovoltaic systems, fuel cells, and compressors; bicycles; and nursing care services. In addition, the company offers automotive-use infotainment systems, head-up displays, automotive speakers and switches, advanced driver assistance systems, and automotive mirrors. Further, it provides aircraft in-flight entertainment systems and communications services; electronic components-mounting machines; welding equipment; projectors; professional AV systems; PCs and tablets; and supply chain management software. Additionally, the company engages in the electronic components, motors, FA devices and electronic materials business. Furthermore, it provides dry and micro batteries; small secondary batteries, including cells and their system products; cylindrical lithium-ion batteries for in-vehicle use; and TVs, digital cameras, video and audio equipment, telephones, kitchen and bath, interior and exterior finishing materials, and raw materials. Panasonic Holdings Corporation was founded in 1918 and is headquartered in Kadoma, Japan.",207548.0,"[{'maxAge': 1, 'name': 'Mr. Yuki  Kusumi', 'age': 60, 'title': 'Group CEO, President & Representative Director', 'yearBorn': 1965, 'fiscalYear': 2025, 'totalPay': 137000000, 'exercisedValue': 0, 'unexercisedValue': 0}, {'maxAge': 1, 'name': 'Mr. Tetsuro  Homma', 'age': 64, 'title': 'Executive VP, Group CEO for China & Northeast Asia and Representative Director', 'yearBorn': 1961, 'fiscalYear': 2025, 'totalPay': 138000000, 'exercisedValue': 0, 'unexercisedValue': 0}, {'maxAge': 1, 'name': 'Mr. Akira  Waniko', 'age': 53, 'title': 'Executive Officer, Group CFO & Director', 'yearBorn': 1972, 'fiscalYear': 2025, 'exercisedValue': 0, 'unexercisedValue': 0}, {'maxAge': 1, 'name': 'Sumitaka  Yoshitomi', 'title': 'General Manager of Accounting & Business Performance Management Office, Financial & Accounting Dept.', 'fiscalYear': 2025, 'exercisedValue': 0, 'unexercisedValue': 0}, {'maxAge': 1, 'name': 'Keigo  Shinjo', 'title': 'Chief of Corporate Finance & IR Department', 'fiscalYear': 2025, 'exercisedValue': 0, 'unexercisedValue': 0}, {'maxAge': 1, 'name': 'Ms. Tatsuo  Ogawa', 'title': 'Group CTO & Executive Officer', 'fiscalYear': 2025, 'exercisedValue': 0, 'unexercisedValue': 0}, {'maxAge': 1, 'name': 'Mr. Hajime  Tamaoki', 'age': 58, 'title': 'EVP, Group CIO, Group CTRO, Dir, President & Representative Dir of Panasonic Operational Excellence', 'yearBorn': 1967, 'fiscalYear': 2025, 'exercisedValue': 0, 'unexercisedValue': 0}, {'maxAge': 1, 'name': 'Kazuhiro  Matsushita', 'title': 'General Manager of Planning and Administration Department', 'fiscalYear': 2025, 'exercisedValue': 0, 'unexercisedValue': 0}, {'maxAge': 1, 'name': 'Ms. Ayako  Shotoku', 'age': 57, 'title': 'Executive Officer, Group GC, Group CRO & Director', 'yearBorn': 1968, 'fiscalYear': 2025, 'exercisedValue': 0, 'unexercisedValue': 0}, {'maxAge': 1, 'name': 'Mr. Tatsuo  Kinoshita', 'title': 'Executive Officer & Group Chief HR Officer', 'fiscalYear': 2025, 'exercisedValue': 0, 'unexercisedValue': 0}]",[],86400,2,2985.0,2914.5,2877.0,2965.0,2985.0,2914.5,2877.0,2965.0,40.0,1.34,1774828800,0.3506,2.37,0.707,21.199183,17.201658,9092000,9092000,9587146,8175020,8175020,0.0,0.0,,,6781076504576,6969018400035,1410.5,3082.0,3320.0,376.0,0.85424775,2645.87,1992.825,48.0,0.016080402,JPY,False,7780780998656,0.02559,2264237982,2334679531,0.01601,0.39215,2334679531,2152.977,1.3490622,1743379200,1774915200,1767139200,,203095998464,137.01,168.85,1.01,,,0.98,12.62,0.914075,0.30140376,20.0,1774828800,EQUITY,2904.5,buy,973905002496,417.148,616543027200,1773315031040,0.715,1.241,7938067922944,33.927,3400.202,0.01352,0.04152,2522190970880,-348545253376.0,505726992384.0,,-0.041,0.31773,0.07767,-0.0083,JPY,6752.T,en-US,US,Equity,Delayed Quote,False,LOW,-80.5,2877.0 - 2965.0,Tokyo,9587146,False,PREPRE,PANASONIC HOLDINGS CORP,Panasonic Holdings Corporation,[],1776925800,False,946944000000,1494.0,1.0591989,1410.5 - 3082.0,-177.5,-0.057592474,91.4075,1778567400,1778567400,1746788340.0,1746788340.0,False,137.01,168.85,258.62988,0.09774852,911.67505,0.45747873,15,20,JPX,finmb_320433,Asia/Tokyo,JST,32400000,jp_market,False,-2.6968174,2904.5,,PANASONIC HOLDINGS,571-8501,1767139200.0,3500.0,1835.0,2872.6667,3000.0,1.8,15.0,,,1.8 - Buy,1778567400.0,1.0,3.0,1.0,5.0,2.0,1775001600.0,http://panasonic.net/ir/,,,,,,,,,,,Panasonic Corporation,2026-04-22
